Job_ID,Link,Title,Company,Place,Description,HTML,Date,Skills
4090117422,https://es.linkedin.com/jobs/view/data-scientist-at-cint-4090117422?position=1&pageNum=0&refId=h%2FfeODxnwsMgPYzmNiQwpw%3D%3D&trackingId=DN5LHFYYPq7zb6nWOwp5%2FA%3D%3D,Data Scientist,Cint,"Barcelona, Catalonia, Spain","Company Description

Who We Are

Cint is a pioneer in research technology (ResTech). Our customers use the Cint platform to post questions and get answers from real people to build business strategies, confidently publish research, accurately measure the impact of digital advertising, and more. The Cint platform is built on a programmatic marketplace, which is the world’s largest, with nearly 300 million respondents in over 150 countries who consent to sharing their opinions, motivations, and behaviours.

We are feeding the world’s curiosity!

Job Description

The Opportunity

As a Data Scientist – Platform Intelligence at Cint, reporting to the VP of Data Science and Analytics, you will provide insights to support the development of new products, enhance the performance of existing ones, and deliver data-driven product solutions in collaboration with product and engineering teams.

You will also be working with Commercial, Operations, and Finance teams to understand, analyze, explain, and predict the impact of platform algorithms on clients and partners.

What You Will Do


Develop a comprehensive, predictive understanding of marketplace dynamics, including price elasticity and demand/supply balance, and their underlying mechanics.
Support ad-hoc requests from stakeholders by conducting exploratory analyses to deepen insights into metrics and trends. Perform A/B testing and other experiments as needed.
Define statistical and machine learning methods, establish modeling standards, and drive their development.
Collaborate with cross-functional teams to design, implement, and test new and existing products.
Create clear, effective deliverables that communicate insights and recommendations through visualizations and presentations tailored to diverse audiences.


Qualifications

What We Are Looking For


Minimum 2+ years of solid experience in a data science role.
Master's degree or equivalent in Statistics, Quantitative Sciences, Data Science, Operations Research, or a related quantitative field.
Strong ability to manipulate, analyze, and interpret large datasets.
In-depth understanding of statistical techniques and concepts (e.g., distributions, hypothesis testing, parametric/non-parametric tests, survey design, sampling theory, experimental design, regression, predictive modeling).
Solid knowledge of machine learning techniques (e.g., clustering, regression, decision trees) and their practical applications and limitations.
Experience applying statistical and modeling techniques in real-world scenarios.
Proficient in Python (for statistical and ML tools).
Proficient in SQL and handling large-scale databases.
Comfortable researching and adopting new methods, tools, and techniques


Essential Qualities


Highly accountable self-starter and quick learner, motivated to deliver results
Data driven with the ability to translate abstract requests into actionable initiatives
Excellent written and verbal communication skills, with the ability to explain and defend analytical techniques to non-experts
Ability to understand the big picture while ensuring attention to detail


Additional Information

Bonus Points If You Have


Experience with online market research methods/products
Experience in Identity graph methodologies
Experience with Identity vendors
Experience working with big data technologies (e.g. Spark)


Our Values

Collaboration is our superpower


We uncover rich perspectives across the world
Success happens together
We deliver across borders.


Innovation is in our blood


We’re pioneers in our industry
Our curiosity is insatiable
We bring the best ideas to life.


We Do What We Say


We’re accountable for our work and actions
Excellence comes as standard
We’re open, honest and kind, always.


We are caring


We learn from each other’s experiences
Stop and listen; every opinion matters
We embrace diversity, equity and inclusion.


More About Cint

In June 2021, Cint acquired Berlin-based GapFish – the world’s largest ISO certified online panel community in the DACH region – and in January 2022, completed the acquisition of US-based Lucid – a programmatic research technology platform that provides access to first-party survey data in over 110 countries.

Cint Group AB (publ), listed on Nasdaq Stockholm, this growth has made Cint a strong global platform with teams across its many global offices, including Stockholm, London, New York, New Orleans, Singapore, Tokyo and Sydney. (www.cint.com)


Show more ","<div class=""description__text description__text--rich"">
        
    
    
    

    <section data-max-lines=""5"" class=""show-more-less-html"">
        <div class=""show-more-less-html__markup show-more-less-html__markup--clamp-after-5
            relative overflow-hidden"">
          <strong>Company Description<br><br></strong><strong>Who We Are<br><br></strong>Cint is a pioneer in research technology (ResTech). Our customers use the Cint platform to post questions and get answers from real people to build business strategies, confidently publish research, accurately measure the impact of digital advertising, and more. The Cint platform is built on a programmatic marketplace, which is the world’s largest, with nearly 300 million respondents in over 150 countries who consent to sharing their opinions, motivations, and behaviours.<br><br>We are feeding the world’s curiosity!<br><br><strong>Job Description<br><br></strong><strong>The Opportunity<br><br></strong>As a Data Scientist – Platform Intelligence at Cint, reporting to the VP of Data Science and Analytics, you will provide insights to support the development of new products, enhance the performance of existing ones, and deliver data-driven product solutions in collaboration with product and engineering teams.<br><br>You will also be working with Commercial, Operations, and Finance teams to understand, analyze, explain, and predict the impact of platform algorithms on clients and partners.<br><br><strong>What You Will Do<br><br></strong><ul><li>Develop a comprehensive, predictive understanding of marketplace dynamics, including price elasticity and demand/supply balance, and their underlying mechanics.</li><li>Support ad-hoc requests from stakeholders by conducting exploratory analyses to deepen insights into metrics and trends. Perform A/B testing and other experiments as needed.</li><li>Define statistical and machine learning methods, establish modeling standards, and drive their development.</li><li>Collaborate with cross-functional teams to design, implement, and test new and existing products.</li><li>Create clear, effective deliverables that communicate insights and recommendations through visualizations and presentations tailored to diverse audiences.<br><br></li></ul><strong>Qualifications<br><br></strong><strong>What We Are Looking For<br><br></strong><ul><li>Minimum 2+ years of solid experience in a data science role.</li><li>Master's degree or equivalent in Statistics, Quantitative Sciences, Data Science, Operations Research, or a related quantitative field.</li><li>Strong ability to manipulate, analyze, and interpret large datasets.</li><li>In-depth understanding of statistical techniques and concepts (e.g., distributions, hypothesis testing, parametric/non-parametric tests, survey design, sampling theory, experimental design, regression, predictive modeling).</li><li>Solid knowledge of machine learning techniques (e.g., clustering, regression, decision trees) and their practical applications and limitations.</li><li>Experience applying statistical and modeling techniques in real-world scenarios.</li><li>Proficient in Python (for statistical and ML tools).</li><li>Proficient in SQL and handling large-scale databases.</li><li>Comfortable researching and adopting new methods, tools, and techniques<br><br></li></ul><strong>Essential Qualities<br><br></strong><ul><li>Highly accountable self-starter and quick learner, motivated to deliver results</li><li>Data driven with the ability to translate abstract requests into actionable initiatives</li><li>Excellent written and verbal communication skills, with the ability to explain and defend analytical techniques to non-experts</li><li>Ability to understand the big picture while ensuring attention to detail<br><br></li></ul><strong>Additional Information<br><br></strong><strong>Bonus Points If You Have<br><br></strong><ul><li>Experience with online market research methods/products</li><li>Experience in Identity graph methodologies</li><li>Experience with Identity vendors</li><li>Experience working with big data technologies (e.g. Spark)<br><br></li></ul><strong>Our Values<br><br></strong><strong>Collaboration is our superpower<br><br></strong><ul><li>We uncover rich perspectives across the world</li><li>Success happens together</li><li>We deliver across borders.<br><br></li></ul><strong>Innovation is in our blood<br><br></strong><ul><li>We’re pioneers in our industry</li><li>Our curiosity is insatiable</li><li>We bring the best ideas to life.<br><br></li></ul><strong>We Do What We Say<br><br></strong><ul><li>We’re accountable for our work and actions</li><li>Excellence comes as standard</li><li>We’re open, honest and kind, always.<br><br></li></ul><strong>We are caring<br><br></strong><ul><li>We learn from each other’s experiences</li><li>Stop and listen; every opinion matters</li><li>We embrace diversity, equity and inclusion.<br><br></li></ul><strong>More About Cint<br><br></strong>In June 2021, Cint acquired Berlin-based GapFish – the world’s largest ISO certified online panel community in the DACH region – and in January 2022, completed the acquisition of US-based Lucid – a programmatic research technology platform that provides access to first-party survey data in over 110 countries.<br><br>Cint Group AB (publ), listed on Nasdaq Stockholm, this growth has made Cint a strong global platform with teams across its many global offices, including Stockholm, London, New York, New Orleans, Singapore, Tokyo and Sydney. (www.cint.com)<br><br>
        </div>

        

    
    
    

    <button aria-expanded=""false"" aria-label=""i18n_show_more"" data-tracking-control-name=""public_jobs_show-more-html-btn"" class=""show-more-less-html__button show-more-less-button
        show-more-less-html__button--more
        ml-0.5"">
<!---->
        
            Show more
          

          <icon class=""show-more-less-html__button-icon show-more-less-button-icon lazy-loaded"" aria-hidden=""true"" aria-busy=""false""><svg xmlns=""http://www.w3.org/2000/svg"" width=""16"" height=""16"" preserveAspectRatio=""xMinYMin meet"" focusable=""false"" class=""lazy-loaded"" aria-busy=""false""><path d=""M8 9l5.93-4L15 6.54l-6.15 4.2a1.5 1.5 0 01-1.69 0L1 6.54 2.07 5z"" fill=""currentColor""></path></svg></icon>
    </button>
  

        

    
    
    

    <button aria-expanded=""true"" aria-label=""i18n_show_less"" data-tracking-control-name=""public_jobs_show-less-html-btn"" class=""show-more-less-html__button show-more-less-button
        show-more-less-html__button--less
        ml-0.5"">
<!---->
        
            Show less
          

          <icon class=""show-more-less-html__button-icon show-more-less-button-icon lazy-loaded"" aria-hidden=""true"" aria-busy=""false""><svg xmlns=""http://www.w3.org/2000/svg"" width=""16"" height=""16"" preserveAspectRatio=""xMinYMin meet"" focusable=""false"" class=""lazy-loaded"" aria-busy=""false""><path d=""M8 7l-5.9 4L1 9.5l6.2-4.2c.5-.3 1.2-.3 1.7 0L15 9.5 13.9 11 8 7z"" fill=""currentColor""></path></svg></icon>
    </button>
  
<!---->    </section>
  
      </div>",2024-12-04,[]
