Job_ID,Link,Title,Company,Place,Description,HTML,Date,Skills
4008659320,https://es.linkedin.com/jobs/view/data-scientist-at-prima-4008659320?position=1&pageNum=0&refId=PHCbVgFtXd5Jw1cHhvBAJA%3D%3D&trackingId=pw4McQjiWVyRzBjNN26TNA%3D%3D,Data Scientist,Prima,"Madrid, Community of Madrid, Spain","¿Estás buscando un nuevo desafío?

¿Te gustaría ayudarnos a dar forma al futuro de los seguros de coche?

Prima podría ser el lugar ideal para ti.

Desde 2015, hemos estado usando nuestra pasión por los datos y la tecnología para reinventar el seguro del coche y ofrecer a los conductores una experiencia excelente a un precio competitivo. Nuestra historia comenzó en Italia, donde rápidamente nos convertimos en el proveedor número uno de seguros de coche online. De hecho, más de 4 millones de conductores confían en nosotros y ahora estamos expandiéndonos para ayudar a millones más de conductores en el Reino Unido y España.

Para impulsar este crecimiento, necesitamos un/a Data Scientist para unirse a nuestro equipo de Pricing & Underwriting .

Este equipo es el motor estratégico detrás del crecimiento de Prima.

Como parte de este equipo, desempeñarás un papel clave en la definición de la estrategia de negocio e impulso de la innovación. Al combinar análisis avanzados y machine learning, ayudarás a mantener nuestros precios competitivos y nuestro riesgo bajo control. Trabajarás en la intersección entre la ciencia de datos y el impacto real, colaborando con equipos multifuncionales para convertir los insights en acciones.

¿Con ganas de generar impacto? Aquí tienes los detalles

Lo que harás


Analizar cualquier tipo de fuente de datos con el objetivo de crear y mejorar la tecnología predictiva patentada por Prima, análisis como: modelos de clasificación para mejora de variables, realización de modelos de predicción Loss Cost, elasticidad precio de la demanda, probabilidad de renovación, optimización del valor de la cartera.
Liderar la implementación de procesos y metodologías en el motor de precios, ya sean mejoras de los modelos predictivos desarrollados, o nuevas features/lógicas.
Continuo análisis de impactos de los proyectos sobre cualquier acción o decisión tomada o pendiente de decidir.
Liderar el traqueo del dato, monitorizando los principales KPI y posterior toma de decisiones.
Agilizar los procedimientos internos, gracias a sistemas de selección automática de clientes, clasificación de documentos y detección de fraudes.


Lo que estamos buscando


Background de negocio y analítico. Buscamos personas con una gran implicación en el negocio, que quieran formar parte no solo del aspecto técnico del rol, sino también tener una visión estratégica en el equipo, además de mostrar habilidades destacadas en el análisis de interpretación del dato. Tan importante es el “qué” como el “por qué”. Además de sentir comodidad proponiendo nuevas metodologías, buscamos proactividad en las alternativas y razonamientos estratégicos que subyacen. La responsabilidad sobre el negocio es clave.
El Data Science de Pricing & Underwriting es cliente y proveedor al mismo tiempo. Somos responsables tanto de las metodologías utilizadas como del impacto de las mismas en el negocio.
Tienes conocimientos y/o experiencia en programación en Python y conoces las principales librerías de análisis de datos y aprendizaje automático (Pandas, Numpy, Scipy, XGBoost, etc.).
Mentalidad crítica y curiosa. Miras el mundo que te rodea y siempre te preguntas ""¿por qué?"". Piensas en cómo mejorar las cosas y buscas que tus ideas se hagan realidad. Además, te rodearán otras cabezas pensantes con gran talento que te enriquecerán y a las que enriquecerás compartiendo vuestros puntos de vista.
Tienes al menos un nivel intermedio-alto de inglés. Prima cada vez es más internacional y buscamos colaborar con otros equipos, por lo que el lenguaje común que utilizamos es el inglés.


Deseable


Tienes experiencia laboral previa en roles similares, con una base en estadística, programación e implementación de algoritmos.
Puedes crear conjuntos de datos utilizando lenguajes de extracción de datos (como MySQL o Redshift).
Puedes analizar y crear modelos en Excel.


Por Qué Te Encantará Trabajar Aquí

Queremos que Prima sea un lugar de trabajo feliz y enriquecedor. Así que, si decides unirte a nosotros, puedes esperar muchos beneficios.

🤸 Máxima flexibilidad: Disfruta de plena flexibilidad: trabaja desde casa, desde la oficina o con una combinación de ambas. Además, podrás trabajar desde cualquier lugar del mundo hasta 30 días al año.

🏁Crece con nosotros: En Prima nos movemos rápido, pero lo hacemos juntos. Accede a recursos de aprendizaje, mentoría y un plan de crecimiento personalizado.

🌈 Desarrolla tu máximo potencial: Tu mejor trabajo empieza cuando te sientes bien. Disfruta de seguro médico privado, descuentos en gimnasios, programas de bienestar y apoyo para la salud mental.

¿Crees que encajas? ¡Postúlate ahora!

En Prima celebramos lo que te hace único/a. Si no cumples con todos los requisitos pero sientes pasión por este rol, igualmente queremos conocerte. La innovación prospera en la diversidad de perspectivas.

Prima se enorgullece de ser una empresa que ofrece igualdad de oportunidades. ¿Necesitas adaptaciones durante el proceso? Escríbenos a talent.acquisition@prima.it. Construyamos juntos el futuro del seguro.
Show more ","<div class=""description__text description__text--rich"">
        
    
    
    

    <section data-max-lines=""5"" class=""show-more-less-html"">
        <div class=""show-more-less-html__markup show-more-less-html__markup--clamp-after-5
            relative overflow-hidden"">
          ¿Estás buscando un nuevo desafío?<br><br>¿Te gustaría ayudarnos a dar forma al futuro de los seguros de coche?<br><br>Prima podría ser el lugar ideal para ti.<br><br>Desde 2015, hemos estado usando nuestra pasión por los datos y la tecnología para reinventar el seguro del coche y ofrecer a los conductores una experiencia excelente a un precio competitivo. Nuestra historia comenzó en Italia, donde rápidamente nos convertimos en el proveedor número uno de seguros de coche online. De hecho, más de 4 millones de conductores confían en nosotros y ahora estamos expandiéndonos para ayudar a millones más de conductores en el Reino Unido y España.<br><br>Para impulsar este crecimiento, necesitamos un/a <strong>Data Scientist</strong> para unirse a nuestro equipo de <strong>Pricing &amp; Underwriting</strong> .<br><br>Este equipo es el motor estratégico detrás del crecimiento de Prima.<br><br>Como parte de este equipo, desempeñarás un papel clave en la definición de la estrategia de negocio e impulso de la innovación. Al combinar análisis avanzados y machine learning, ayudarás a mantener nuestros precios competitivos y nuestro riesgo bajo control. Trabajarás en la intersección entre la ciencia de datos y el impacto real, colaborando con equipos multifuncionales para convertir los insights en acciones.<br><br><strong>¿Con ganas de generar impacto? Aquí tienes los detalles<br><br></strong><strong>Lo que harás<br><br></strong><ul><li>Analizar cualquier tipo de fuente de datos con el objetivo de crear y mejorar la tecnología predictiva patentada por Prima, análisis como: modelos de clasificación para mejora de variables, realización de modelos de predicción Loss Cost, elasticidad precio de la demanda, probabilidad de renovación, optimización del valor de la cartera.</li><li>Liderar la implementación de procesos y metodologías en el motor de precios, ya sean mejoras de los modelos predictivos desarrollados, o nuevas features/lógicas.</li><li>Continuo análisis de impactos de los proyectos sobre cualquier acción o decisión tomada o pendiente de decidir.</li><li>Liderar el traqueo del dato, monitorizando los principales KPI y posterior toma de decisiones.</li><li>Agilizar los procedimientos internos, gracias a sistemas de selección automática de clientes, clasificación de documentos y detección de fraudes.<br><br></li></ul><strong>Lo que estamos buscando<br><br></strong><ul><li>Background de negocio y analítico. Buscamos personas con una gran implicación en el negocio, que quieran formar parte no solo del aspecto técnico del rol, sino también tener una visión estratégica en el equipo, además de mostrar habilidades destacadas en el análisis de interpretación del dato. Tan importante es el “qué” como el “por qué”. Además de sentir comodidad proponiendo nuevas metodologías, buscamos proactividad en las alternativas y razonamientos estratégicos que subyacen. La responsabilidad sobre el negocio es clave.</li><li>El Data Science de Pricing &amp; Underwriting es cliente y proveedor al mismo tiempo. Somos responsables tanto de las metodologías utilizadas como del impacto de las mismas en el negocio.</li><li>Tienes conocimientos y/o experiencia en programación en Python y conoces las principales librerías de análisis de datos y aprendizaje automático (Pandas, Numpy, Scipy, XGBoost, etc.).</li><li>Mentalidad crítica y curiosa. Miras el mundo que te rodea y siempre te preguntas ""¿por qué?"". Piensas en cómo mejorar las cosas y buscas que tus ideas se hagan realidad. Además, te rodearán otras cabezas pensantes con gran talento que te enriquecerán y a las que enriquecerás compartiendo vuestros puntos de vista.</li><li>Tienes al menos un nivel intermedio-alto de inglés. Prima cada vez es más internacional y buscamos colaborar con otros equipos, por lo que el lenguaje común que utilizamos es el inglés.<br><br></li></ul><strong>Deseable<br><br></strong><ul><li>Tienes experiencia laboral previa en roles similares, con una base en estadística, programación e implementación de algoritmos.</li><li>Puedes crear conjuntos de datos utilizando lenguajes de extracción de datos (como MySQL o Redshift).</li><li>Puedes analizar y crear modelos en Excel.<br><br></li></ul><strong>Por Qué Te Encantará Trabajar Aquí<br><br></strong>Queremos que Prima sea un lugar de trabajo feliz y enriquecedor. Así que, si decides unirte a nosotros, puedes esperar muchos beneficios.<br><br><strong>🤸 Máxima flexibilidad: </strong> Disfruta de plena flexibilidad: trabaja desde casa, desde la oficina o con una combinación de ambas. Además, podrás trabajar desde cualquier lugar del mundo hasta 30 días al año.<br><br>🏁<strong>Crece con nosotros:</strong> En Prima nos movemos rápido, pero lo hacemos juntos. Accede a recursos de aprendizaje, mentoría y un plan de crecimiento personalizado.<br><br>🌈 <strong>Desarrolla tu máximo potencial:</strong> Tu mejor trabajo empieza cuando te sientes bien. Disfruta de seguro médico privado, descuentos en gimnasios, programas de bienestar y apoyo para la salud mental.<br><br>¿Crees que encajas? <strong>¡Postúlate ahora!<br><br></strong>En Prima celebramos lo que te hace único/a. Si no cumples con todos los requisitos pero sientes pasión por este rol, igualmente queremos conocerte. La innovación prospera en la diversidad de perspectivas.<br><br><em>Prima se enorgullece de ser una empresa que ofrece igualdad de oportunidades. ¿Necesitas adaptaciones durante el proceso? Escríbenos a talent.acquisition@prima.it. Construyamos juntos el futuro del seguro.</em>
        </div>

        

    
    
    

    <button aria-expanded=""false"" aria-label=""Show more"" data-tracking-control-name=""public_jobs_show-more-html-btn"" class=""show-more-less-html__button show-more-less-button
        show-more-less-html__button--more
        ml-0.5"">
<!---->
        
            Show more
          

          <icon class=""show-more-less-html__button-icon show-more-less-button-icon lazy-loaded"" aria-hidden=""true"" aria-busy=""false""><svg xmlns=""http://www.w3.org/2000/svg"" width=""16"" height=""16"" preserveAspectRatio=""xMinYMin meet"" focusable=""false"" class=""lazy-loaded"" aria-busy=""false""><path d=""M8 9l5.93-4L15 6.54l-6.15 4.2a1.5 1.5 0 01-1.69 0L1 6.54 2.07 5z"" fill=""currentColor""></path></svg></icon>
    </button>
  

        

    
    
    

    <button aria-expanded=""true"" aria-label=""Show less"" data-tracking-control-name=""public_jobs_show-less-html-btn"" class=""show-more-less-html__button show-more-less-button
        show-more-less-html__button--less
        ml-0.5"">
<!---->
        
            Show less
          

          <icon class=""show-more-less-html__button-icon show-more-less-button-icon lazy-loaded"" aria-hidden=""true"" aria-busy=""false""><svg xmlns=""http://www.w3.org/2000/svg"" width=""16"" height=""16"" preserveAspectRatio=""xMinYMin meet"" focusable=""false"" class=""lazy-loaded"" aria-busy=""false""><path d=""M8 7l-5.9 4L1 9.5l6.2-4.2c.5-.3 1.2-.3 1.7 0L15 9.5 13.9 11 8 7z"" fill=""currentColor""></path></svg></icon>
    </button>
  
<!---->    </section>
  
      </div>",2025-06-16,[]
4207636145,https://es.linkedin.com/jobs/view/data-scientist-strategy-value-creation-consulting-at-kpmg-espa%C3%B1a-4207636145?position=2&pageNum=0&refId=PHCbVgFtXd5Jw1cHhvBAJA%3D%3D&trackingId=410tV%2BiKc%2FR6NMFv6l6OJw%3D%3D,Data Scientist Strategy & Value Creation Consulting,KPMG España,"Madrid, Community of Madrid, Spain","Ubicación:

Madrid, ES, 28046

Fecha de publicación: 12 jun 2025

¿Te defines por tu talento y tu visión?

Entonces, tú también puedes marcar la diferencia. Únete a un entorno profesional que contribuye a la transformación de empresas y sociedad. Alcanza tus metas, supera tus límites y únete a una firma que va más allá de los servicios profesionales.

Porque marcar la diferencia no es solo algo que decimos. Es lo que hacemos.

Desarrolla tu carrera con nosotros.

Como Científico/a de Datos en la división de Strategy & Value Creation de KPMG, combinarás experiencia técnica con conocimientos empresariales para identificar y cuantificar el potencial de mejora específico de cada cliente utilizando sofisticados métodos de análisis. Formarás parte de un equipo dedicado y colaborativo que utiliza métodos y herramientas de análisis de última generación para ayudar a nuestros clientes a identificar y resolver problemas críticos en forma de data driven.

En este equipo, podrás dominar ambos mundos: la consultoría Estratégica y de Creación de Valor con la Ciencia de datos.

¿Qué podrás hacer?

Si tienes interés en resolver problemas de análisis desafiantes basados en grandes cantidades de datos y dar forma estratégica al futuro, ¡Esta es tu oportunidad!

En el equipo de Strategy & Value Creation podrás:


Participar en una variedad de proyectos y temas diferentes para empresas internacionales e inversores (de capital privado).
Como parte del equipo podrás participar en el desarrollo de conceptos para la mejora sostenible del valor, así como en estrategias de cartera, crecimiento y transacciones.
Una parte esencial de estos análisis es la aplicación de métodos y herramientas de vanguardia para cuantificar el potencial de mejora del valor a partir de datos externos e internos.
Extraer y analizar bases de datos de la empresa para impulsar la optimización y las mejoras en la producción, la cadena de suministro, la excelencia comercial, la eficacia organizativa y la gestión del capital circulante.
Trabajar en colaboración con la dirección y los miembros del equipo para garantizar que los proyectos de datos se alineen con los objetivos de la organización y los respalden.
Con el fin de ofrecerte el mejor apoyo posible en su desarrollo personal y profesional, podrás contar con diversos programas de formación. Además de los cursos de formación tradicionales, participará en nuestra Global Analytics Academy y completarás nuestro itinerario de aprendizaje sobre datos y análisis con cursos de formación sobre análisis espacial y predictivo.


¿Qué necesitas saber?


Grado universitario en análisis de negocios, economía, ingeniería, informática empresarial o similar.
Experiencia previa (prácticas) en las áreas de consultoría estratégica, consultoría operativa o industria y/o data analytics.
Gran capacidad analítica y extraordinario interés por el análisis de datos complejos (por ejemplo, análisis espacial y predictivo, Six-Sigma), visualización de datos y temas financieros u operativos, que haya demostrado mediante una primera experiencia práctica.
Entusiasmo y experiencia inicial con herramientas como Alteryx, Tableau o Power Bl, así como con lenguajes de programación como Python y R.
Sólidas habilidades comunicativas en español e inglés. Se valorarán conocimientos de idiomas adicionales.
Dado que nuestros clientes operan en todo el mundo, se valorará la experiencia en el extranjero y la disponibilidad para viajar.


¿Qué valor añadido te podemos aportar?


Un gran ambiente de trabajo, tanto dentro como fuera de la oficina
Oportunidades internacionales y red de contactos global
Formacióncontinuay plan de carrera a tu medida
Salario competitivo y plan de remuneración flexible
31 días laborables de vacaciones
La tarde de tu cumpleaños libre
Flexibilidad y posibilidad de teletrabajo
Acceso a Kteam, nuestra plataforma de bienestar, servicios, solidaridad y promociones
Los beneficios pueden variar para programas de becas y/o prácticas


Nuestro compromiso en KPMG es promover ambientes de trabajo en los que se trate con respeto y dignidad a las personas, garantizando la igualdad de oportunidades en su selección, formación y promoción ofreciendo un entorno de trabajo libre de cualquier discriminación por motivo de género, edad, discapacidad, orientación sexual, identidad o expresión de género, religión, etnia, estado civil o cualquier otra circunstancia personal o social. Y es que cada persona tiene un valor único y especial que aportar a la firma.

Nuestros valores marcan la diferencia. Marca la diferencia, impulsa tu talento.
Show more ","<div class=""description__text description__text--rich"">
        
    
    
    

    <section data-max-lines=""5"" class=""show-more-less-html"">
        <div class=""show-more-less-html__markup show-more-less-html__markup--clamp-after-5
            relative overflow-hidden"">
          Ubicación:<br><br>Madrid, ES, 28046<br><br>Fecha de publicación: 12 jun 2025<br><br><strong>¿Te defines por tu talento y tu visión? <br><br></strong>Entonces, tú también puedes marcar la diferencia. Únete a un entorno profesional que contribuye a la transformación de empresas y sociedad. Alcanza tus metas, supera tus límites y únete a una firma que va más allá de los servicios profesionales.<br><br><strong>Porque marcar la diferencia no es solo algo que decimos. Es lo que hacemos. <br><br></strong><strong>Desarrolla tu carrera con nosotros. <br><br></strong>Como <strong>Científico/a de Datos </strong>en la división de<strong> Strategy &amp; Value Creation </strong>de KPMG, combinarás experiencia técnica con conocimientos empresariales para identificar y cuantificar el potencial de mejora específico de cada cliente utilizando sofisticados métodos de análisis. Formarás parte de un equipo dedicado y colaborativo que utiliza métodos y herramientas de análisis de última generación para ayudar a nuestros clientes a identificar y resolver problemas críticos en forma de data driven.<br><br>En este equipo, podrás dominar ambos mundos: la consultoría Estratégica y de Creación de Valor con la Ciencia de datos.<br><br><strong>¿Qué podrás hacer?<br><br></strong>Si tienes interés en resolver problemas de análisis desafiantes basados en grandes cantidades de datos y dar forma estratégica al futuro, ¡Esta es tu oportunidad!<br><br>En el equipo de <strong>Strategy &amp; Value Creation </strong>podrás:<br><br><ul><li> Participar en una variedad de proyectos y temas diferentes para empresas internacionales e inversores (de capital privado). </li><li> Como parte del equipo podrás participar en el desarrollo de conceptos para la mejora sostenible del valor, así como en estrategias de cartera, crecimiento y transacciones. </li><li> Una parte esencial de estos análisis es la aplicación de métodos y herramientas de vanguardia para cuantificar el potencial de mejora del valor a partir de datos externos e internos. </li><li> Extraer y analizar bases de datos de la empresa para impulsar la optimización y las mejoras en la producción, la cadena de suministro, la excelencia comercial, la eficacia organizativa y la gestión del capital circulante. </li><li> Trabajar en colaboración con la dirección y los miembros del equipo para garantizar que los proyectos de datos se alineen con los objetivos de la organización y los respalden. </li><li> Con el fin de ofrecerte el mejor apoyo posible en su desarrollo personal y profesional, podrás contar con diversos programas de formación. Además de los cursos de formación tradicionales, participará en nuestra Global Analytics Academy y completarás nuestro itinerario de aprendizaje sobre datos y análisis con cursos de formación sobre análisis espacial y predictivo. <br><br></li></ul><strong>¿Qué necesitas saber?<br><br></strong><ul><li> Grado universitario en análisis de negocios, economía, ingeniería, informática empresarial o similar. </li><li> Experiencia previa (prácticas) en las áreas de consultoría estratégica, consultoría operativa o industria y/o data analytics. </li><li> Gran capacidad analítica y extraordinario interés por el análisis de datos complejos (por ejemplo, análisis espacial y predictivo, Six-Sigma), visualización de datos y temas financieros u operativos, que haya demostrado mediante una primera experiencia práctica. </li><li> Entusiasmo y experiencia inicial con herramientas como Alteryx, Tableau o Power Bl, así como con lenguajes de programación como Python y R. </li><li> Sólidas habilidades comunicativas en español e inglés. Se valorarán conocimientos de idiomas adicionales. </li><li> Dado que nuestros clientes operan en todo el mundo, se valorará la experiencia en el extranjero y la disponibilidad para viajar. <br><br></li></ul><strong>¿Qué valor añadido te podemos aportar?<br><br></strong><ul><li>Un gran ambiente de trabajo, tanto dentro como fuera de la oficina</li><li>Oportunidades internacionales y red de contactos global</li><li>Formacióncontinuay plan de carrera a tu medida</li><li>Salario competitivo y plan de remuneración flexible</li><li>31 días laborables de vacaciones</li><li>La tarde de tu cumpleaños libre</li><li>Flexibilidad y posibilidad de teletrabajo</li><li>Acceso a Kteam, nuestra plataforma de bienestar, servicios, solidaridad y promociones </li><li>Los beneficios pueden variar para programas de becas y/o prácticas<br><br></li></ul>Nuestro compromiso en KPMG es promover ambientes de trabajo en los que se trate con respeto y dignidad a las personas, garantizando la igualdad de oportunidades en su selección, formación y promoción ofreciendo un entorno de trabajo libre de cualquier discriminación por motivo de género, edad, discapacidad, orientación sexual, identidad o expresión de género, religión, etnia, estado civil o cualquier otra circunstancia personal o social. Y es que cada persona tiene un valor único y especial que aportar a la firma.<br><br>Nuestros valores marcan la diferencia. Marca la diferencia, impulsa tu talento.
        </div>

        

    
    
    

    <button aria-expanded=""false"" aria-label=""Show more"" data-tracking-control-name=""public_jobs_show-more-html-btn"" class=""show-more-less-html__button show-more-less-button
        show-more-less-html__button--more
        ml-0.5"">
<!---->
        
            Show more
          

          <icon class=""show-more-less-html__button-icon show-more-less-button-icon lazy-loaded"" aria-hidden=""true"" aria-busy=""false""><svg xmlns=""http://www.w3.org/2000/svg"" width=""16"" height=""16"" preserveAspectRatio=""xMinYMin meet"" focusable=""false"" class=""lazy-loaded"" aria-busy=""false""><path d=""M8 9l5.93-4L15 6.54l-6.15 4.2a1.5 1.5 0 01-1.69 0L1 6.54 2.07 5z"" fill=""currentColor""></path></svg></icon>
    </button>
  

        

    
    
    

    <button aria-expanded=""true"" aria-label=""Show less"" data-tracking-control-name=""public_jobs_show-less-html-btn"" class=""show-more-less-html__button show-more-less-button
        show-more-less-html__button--less
        ml-0.5"">
<!---->
        
            Show less
          

          <icon class=""show-more-less-html__button-icon show-more-less-button-icon lazy-loaded"" aria-hidden=""true"" aria-busy=""false""><svg xmlns=""http://www.w3.org/2000/svg"" width=""16"" height=""16"" preserveAspectRatio=""xMinYMin meet"" focusable=""false"" class=""lazy-loaded"" aria-busy=""false""><path d=""M8 7l-5.9 4L1 9.5l6.2-4.2c.5-.3 1.2-.3 1.7 0L15 9.5 13.9 11 8 7z"" fill=""currentColor""></path></svg></icon>
    </button>
  
<!---->    </section>
  
      </div>",2025-06-19,[]
