Job_ID,Link,Title,Company,Place,Description,HTML,Date,Skills
3983672350,https://se.linkedin.com/jobs/view/data-scientist-at-trygg-hansa-3983672350?position=1&pageNum=0&refId=wP7PQDCy1dTsoCo1y%2FCNyg%3D%3D&trackingId=%2FM5pE2WN4nHuB7hC%2BQdgSw%3D%3D&trk=public_jobs_jserp-result_search-card,Data Scientist,Trygg-Hansa,"Stockholm, Stockholm County, Sweden","Data, Analys & Rapportering är ett nyetablerat team som stöttar samtliga funktioner inom Commercial Lines i syfte att uppnå ett högre användande av data och analys i aktiviteter och beslut.

Vi supporterar organisationen samtidigt som vi kontinuerligt söker tillämpningar inom analys, maskininlärning (ML) och AI som driver utveckling och lönsamhet.

Teamet har också ett övergripande ansvar för Commercial Lines rapportering och rapporteringsplattform i Power BI.

Vi söker nu en kund- och affärsfokuserad Data Scientist som vill jobba i ett team med höga målsättningar inom ett av Commercial Lines strategiska satsningsområden.

Du utforskar, analyserar och visualiserar stora mängder kunddata från olika datakällor och bygger prediktiva modeller som ökar träffsäkerheten och skapar värde i våra aktiviteter och kundinteraktioner.

Om rollen 

Som Data Scientist kommer du att jobba med både operativa och strategiska frågeställningar.

Du utforskar och testar nya ML- och AI-metoder och verktyg och är med och utvecklar vår data- och analysmiljö.

I rollen arbetar du både under eget ansvar och i nära samarbete med andra analytiker, intressenter och kollegor från många olika delar av organisationen.

Exempel På Arbetsuppgifter Och Ansvarsområden


Kombinera och transformera stora mängder data från både interna och externa datakällor.
Genomföra kvantitativ analys och segmentering i syfte att bättre förstå våra kunders behov och beteenden, samt identifiera trender och segment med hög potential.
Kontinuerligt söka nya ML och AI use-cases, samt delta i, initiera och vara ansvarig för analysprojekt.
Bygga och implementera prediktiva modeller som gör våra aktiviteter mer träffsäkra och lönsamma.
Automatisera modeller och dataflöden.
I samarbete med IT säkerställa access och integrationer med nya och befintliga datakällor och bidra i utvecklingen av Commercial Lines data- och analysmiljö.
Presentera analysresultat och ge rekommendationer till våra intressenter.


Placeringsort är i Stockholm eller Malmö och rapporterar till Chef Data, Analys & Rapportering. 

Din profil och kvalifikationer

För att lyckas och trivas i denna roll tror vi att du har: 


Master/Magister- eller civilingenjörsexamen med inriktning mot Statistik/Matematik/Data.
några års erfarenhet i liknande roll.
mycket goda kunskaper i statistisk analys och metoder.
erfarenhet av att bygga och implementera prediktiva modeller.
goda kunskaper i SQL och ETL-processer.
erfarenhet av analys och modellering med Python och/eller R.
förmåga att presentera analysresultat på ett pedagogiskt sätt.
förmåga att uttrycka dig väl på svenska och engelska både i tal och skrift. 


Som person är du skicklig på att systematiskt bryta ner och hantera komplexa frågor.

Du tar gärna initiativ, arbetar effektivt och har en motivation att nå framdrift.

Du är nyfiken på att förstå affärens och mottagarnas behov och utvecklar därefter datadrivna lösningar som gör skillnad i verksamheten.

Du uppskattar att samarbeta med människor från olika bakgrunder för att tillsammans nå förbättrade resultat. 

Vad vi erbjuder dig

Hos oss blir du en del av ett team med kunniga och nyfikna kollegor och en inkluderande arbetsplats med ett stort hjärta.

Trygg-Hansa är en arbetsplats där alla ska kunna vara sig själva. Vi tror på att utveckling och lärande något som ständigt pågår – och vi vill att du växer.

Vi tror också att ett personligt engagemang är bra både för dig och för företaget. Här kan alla använda några arbetsdagar per år till ideellt arbete.

Ansökan 

Välkommen med din ansökan via länken nedan. Då urvalet sker löpande ser vi gärna att du inkommer med din ansökan snarast möjligt, dock senast 2024-08-18. 

Vid frågor om tjänsten, vänligen kontakta rekryterande chef Frank Svensson på via mejl: frank.svensson@trygghansa.se. 

Vi ser fram emot din ansökan! 

Vi undanber oss kontakt från annons-, konsult- och rekryteringsföretag gällande våra annonserade roller.

Fackliga representanter  

Akademikerföreningen: Cecilia Jarlstedt, cecilia.jarlstedt@trygghansa.se    

Forena: Elias Bakk, 070-730 68 54  

jobbrekvisitions-ID: 26171

Trygg-Hansa har gjort skillnad i människors liv sedan 1828 och är i dag en del av Tryg-koncernen, Skandinaviens största sakförsäkringsbolag. Som medarbetare på Trygg-Hansa arbetar du med 7 500 engagerade kollegor över hela Tryg-koncernen i Sverige, Norge och Danmark. Tillsammans skapar vi trygghet för livet.


Show more ","<div class=""description__text description__text--rich"">
        
    
    
    

    <section data-max-lines=""5"" class=""show-more-less-html"">
        <div class=""show-more-less-html__markup show-more-less-html__markup--clamp-after-5
            relative overflow-hidden"">
          Data, Analys &amp; Rapportering är ett nyetablerat team som stöttar samtliga funktioner inom Commercial Lines i syfte att uppnå ett högre användande av data och analys i aktiviteter och beslut.<br><br>Vi supporterar organisationen samtidigt som vi kontinuerligt söker tillämpningar inom analys, maskininlärning (ML) och AI som driver utveckling och lönsamhet.<br><br>Teamet har också ett övergripande ansvar för Commercial Lines rapportering och rapporteringsplattform i Power BI.<br><br>Vi söker nu en kund- och affärsfokuserad Data Scientist som vill jobba i ett team med höga målsättningar inom ett av Commercial Lines strategiska satsningsområden.<br><br>Du utforskar, analyserar och visualiserar stora mängder kunddata från olika datakällor och bygger prediktiva modeller som ökar träffsäkerheten och skapar värde i våra aktiviteter och kundinteraktioner.<br><br><strong> Om rollen  <br><br></strong>Som Data Scientist kommer du att jobba med både operativa och strategiska frågeställningar.<br><br>Du utforskar och testar nya ML- och AI-metoder och verktyg och är med och utvecklar vår data- och analysmiljö.<br><br>I rollen arbetar du både under eget ansvar och i nära samarbete med andra analytiker, intressenter och kollegor från många olika delar av organisationen.<br><br><strong>Exempel På Arbetsuppgifter Och Ansvarsområden<br><br></strong><ul><li> Kombinera och transformera stora mängder data från både interna och externa datakällor. </li><li> Genomföra kvantitativ analys och segmentering i syfte att bättre förstå våra kunders behov och beteenden, samt identifiera trender och segment med hög potential. </li><li> Kontinuerligt söka nya ML och AI use-cases, samt delta i, initiera och vara ansvarig för analysprojekt. </li><li> Bygga och implementera prediktiva modeller som gör våra aktiviteter mer träffsäkra och lönsamma. </li><li> Automatisera modeller och dataflöden. </li><li> I samarbete med IT säkerställa access och integrationer med nya och befintliga datakällor och bidra i utvecklingen av Commercial Lines data- och analysmiljö. </li><li> Presentera analysresultat och ge rekommendationer till våra intressenter. <br><br></li></ul>Placeringsort är i Stockholm eller Malmö och rapporterar till Chef Data, Analys &amp; Rapportering. <br><br><strong> Din profil och kvalifikationer <br><br></strong>För att lyckas och trivas i denna roll tror vi att du har: <br><br><ul><li> Master/Magister- eller civilingenjörsexamen med inriktning mot Statistik/Matematik/Data. </li><li> några års erfarenhet i liknande roll. </li><li> mycket goda kunskaper i statistisk analys och metoder. </li><li> erfarenhet av att bygga och implementera prediktiva modeller. </li><li> goda kunskaper i SQL och ETL-processer. </li><li> erfarenhet av analys och modellering med Python och/eller R. </li><li> förmåga att presentera analysresultat på ett pedagogiskt sätt. </li><li> förmåga att uttrycka dig väl på svenska och engelska både i tal och skrift.  <br><br></li></ul>Som person är du skicklig på att systematiskt bryta ner och hantera komplexa frågor.<br><br>Du tar gärna initiativ, arbetar effektivt och har en motivation att nå framdrift.<br><br>Du är nyfiken på att förstå affärens och mottagarnas behov och utvecklar därefter datadrivna lösningar som gör skillnad i verksamheten.<br><br>Du uppskattar att samarbeta med människor från olika bakgrunder för att tillsammans nå förbättrade resultat. <br><br><strong> Vad vi erbjuder dig <br><br></strong>Hos oss blir du en del av ett team med kunniga och nyfikna kollegor och en inkluderande arbetsplats med ett stort hjärta.<br><br>Trygg-Hansa är en arbetsplats där alla ska kunna vara sig själva. Vi tror på att utveckling och lärande något som ständigt pågår – och vi vill att du växer.<br><br>Vi tror också att ett personligt engagemang är bra både för dig och för företaget. Här kan alla använda några arbetsdagar per år till ideellt arbete.<br><br><strong> Ansökan  <br><br></strong>Välkommen med din ansökan via länken nedan. Då urvalet sker löpande ser vi gärna att du inkommer med din ansökan snarast möjligt, dock <strong>senast 2024-08-18.  <br><br></strong>Vid frågor om tjänsten, vänligen kontakta rekryterande chef Frank Svensson på via mejl: frank.svensson@trygghansa.se. <br><br>Vi ser fram emot din ansökan! <br><br>Vi undanber oss kontakt från annons-, konsult- och rekryteringsföretag gällande våra annonserade roller.<br><br><strong> Fackliga representanter   <br><br></strong>Akademikerföreningen: Cecilia Jarlstedt, cecilia.jarlstedt@trygghansa.se    <br><br>Forena: Elias Bakk, 070-730 68 54  <br><br>jobbrekvisitions-ID: 26171<br><br>Trygg-Hansa har gjort skillnad i människors liv sedan 1828 och är i dag en del av Tryg-koncernen, Skandinaviens största sakförsäkringsbolag. Som medarbetare på Trygg-Hansa arbetar du med 7 500 engagerade kollegor över hela Tryg-koncernen i Sverige, Norge och Danmark. Tillsammans skapar vi trygghet för livet.<br><br>
        </div>

        

    
    
    

    <button aria-expanded=""false"" aria-label=""i18n_show_more"" data-tracking-control-name=""public_jobs_show-more-html-btn"" class=""show-more-less-html__button show-more-less-button
        show-more-less-html__button--more
        ml-0.5"">
<!---->
        
            Show more
          

          <icon class=""show-more-less-html__button-icon show-more-less-button-icon lazy-loaded"" aria-hidden=""true"" aria-busy=""false""><svg xmlns=""http://www.w3.org/2000/svg"" width=""16"" height=""16"" preserveAspectRatio=""xMinYMin meet"" focusable=""false"" class=""lazy-loaded"" aria-busy=""false""><path d=""M8 9l5.93-4L15 6.54l-6.15 4.2a1.5 1.5 0 01-1.69 0L1 6.54 2.07 5z"" fill=""currentColor""></path></svg></icon>
    </button>
  

        

    
    
    

    <button aria-expanded=""true"" aria-label=""i18n_show_less"" data-tracking-control-name=""public_jobs_show-less-html-btn"" class=""show-more-less-html__button show-more-less-button
        show-more-less-html__button--less
        ml-0.5"">
<!---->
        
            Show less
          

          <icon class=""show-more-less-html__button-icon show-more-less-button-icon lazy-loaded"" aria-hidden=""true"" aria-busy=""false""><svg xmlns=""http://www.w3.org/2000/svg"" width=""16"" height=""16"" preserveAspectRatio=""xMinYMin meet"" focusable=""false"" class=""lazy-loaded"" aria-busy=""false""><path d=""M8 7l-5.9 4L1 9.5l6.2-4.2c.5-.3 1.2-.3 1.7 0L15 9.5 13.9 11 8 7z"" fill=""currentColor""></path></svg></icon>
    </button>
  
<!---->    </section>
  
      </div>",2024-07-28,[]
3989623632,https://se.linkedin.com/jobs/view/data-scientist-play-x-at-spotify-3989623632?position=3&pageNum=0&refId=wP7PQDCy1dTsoCo1y%2FCNyg%3D%3D&trackingId=gDcD7zFj1mbQwGsiGJdX%2FQ%3D%3D&trk=public_jobs_jserp-result_search-card,Data Scientist - Play X,Spotify,"Stockholm, Stockholm County, Sweden","Delivering the best Spotify experience possible, to as many people as possible, in as many moments as possible. That’s what the Experience team is all about. We use our deep understanding of consumer expectations to enrich the lives of millions of our users all over the world, bringing the audio and video they love to the devices, apps and platforms they use every day.

We are looking for a Data Scientist to join one of our Experience Mission teams (Play X).

The Experience Mission is responsible for all of Spotify consumer experiences across our mobile apps as well as platforms like web, TVs, speakers, cars, wearables, and partner application integrations to make Spotify available wherever our users are.

In this specific individual contributor role you will support in bringing high quality audio and video experiences to Spotify users and the global artist community alike. We are laser focused on ensuring all our playback experiences and reporting are of the highest quality. We provide playback related data science knowledge to the organization by empowering evidence-based decision making and building data-intensive tooling to drive product improvements.

What You'll Do


Contribute to improving the core and ubiquity playback performance experience across Spotify’s fast evolving audio and video formats.
Lead the creation, validation and monitoring of video performance metrics for non-mobile clients.
Use data science methods to independently identify and work on the most impactful user problems for prioritization.
Partner with other data scientists to thoughtfully inform, design, implement A/B tests and rollouts across formats and platforms to deliver actionable insights.
Deliver on large scale analyses, dashboard development and data pipeline creation to empower data-driven decision making.
Communicate insights and recommendations to collaborators and stakeholders.
Collaborate closely across disciplines with product, engineering and design.


Who You Are


Knowledgeable about data science and product insights. We use languages such as Python and SQL (with some occasional Scala). Although you might not have a background in our field, bringing knowledge and experience from other fields is merited.
Strong analytical skills with a passion for solving complex problems.
Able to work autonomously, capable of solving loosely defined problems and translating sophisticated thinking into practical application for diverse audiences.
Communicative person who values building strong relationships with colleagues.
Comfortable working in complex technical problem spaces and passionate about product insights and data science methods for improving the user experience.
Practical experience with A/B testing methodologies, designing and executing experiments, and data visualization tooling (we use Tableau and Data Studio).


Where You'll Be


We are a distributed workforce enabling our band members to find a work mode that is best for them!
Where in the world? For this role, you can work from Stockholm or London.
Working hours? We operate within the Central European and GMT time zones for collaboration and ask that all be located in that time zone.
Prefer an office to work from home instead? Not a problem! We have plenty of options for your working preferences. Find more information about our Work From Anywhere options here.


#JobSite-Main-DataResearchAndInsights

#JobSite-Sub-DataScience

Today, we are the world’s most popular audio streaming subscription service.
Show more ","<div class=""description__text description__text--rich"">
        
    
    
    

    <section data-max-lines=""5"" class=""show-more-less-html"">
        <div class=""show-more-less-html__markup show-more-less-html__markup--clamp-after-5
            relative overflow-hidden"">
          Delivering the best Spotify experience possible, to as many people as possible, in as many moments as possible. That’s what the Experience team is all about. We use our deep understanding of consumer expectations to enrich the lives of millions of our users all over the world, bringing the audio and video they love to the devices, apps and platforms they use every day.<br><br>We are looking for a Data Scientist to join one of our Experience Mission teams (Play X).<br><br>The Experience Mission is responsible for all of Spotify consumer experiences across our mobile apps as well as platforms like web, TVs, speakers, cars, wearables, and partner application integrations to make Spotify available wherever our users are.<br><br>In this specific individual contributor role you will support in bringing high quality audio and video experiences to Spotify users and the global artist community alike. We are laser focused on ensuring all our playback experiences and reporting are of the highest quality. We provide playback related data science knowledge to the organization by empowering evidence-based decision making and building data-intensive tooling to drive product improvements.<br><br>What You'll Do<br><br><ul><li>Contribute to improving the core and ubiquity playback performance experience across Spotify’s fast evolving audio and video formats.</li><li>Lead the creation, validation and monitoring of video performance metrics for non-mobile clients.</li><li>Use data science methods to independently identify and work on the most impactful user problems for prioritization.</li><li>Partner with other data scientists to thoughtfully inform, design, implement A/B tests and rollouts across formats and platforms to deliver actionable insights.</li><li>Deliver on large scale analyses, dashboard development and data pipeline creation to empower data-driven decision making.</li><li>Communicate insights and recommendations to collaborators and stakeholders.</li><li>Collaborate closely across disciplines with product, engineering and design.<br><br></li></ul>Who You Are<br><br><ul><li>Knowledgeable about data science and product insights. We use languages such as Python and SQL (with some occasional Scala). Although you might not have a background in our field, bringing knowledge and experience from other fields is merited.</li><li>Strong analytical skills with a passion for solving complex problems.</li><li>Able to work autonomously, capable of solving loosely defined problems and translating sophisticated thinking into practical application for diverse audiences.</li><li>Communicative person who values building strong relationships with colleagues.</li><li>Comfortable working in complex technical problem spaces and passionate about product insights and data science methods for improving the user experience.</li><li>Practical experience with A/B testing methodologies, designing and executing experiments, and data visualization tooling (we use Tableau and Data Studio).<br><br></li></ul>Where You'll Be<br><br><ul><li>We are a distributed workforce enabling our band members to find a work mode that is best for them!</li><li>Where in the world? For this role, you can work from Stockholm or London.</li><li>Working hours? We operate within the Central European and GMT time zones for collaboration and ask that all be located in that time zone.</li><li>Prefer an office to work from home instead? Not a problem! We have plenty of options for your working preferences. Find more information about our Work From Anywhere options here.<br><br></li></ul>#JobSite-Main-DataResearchAndInsights<br><br>#JobSite-Sub-DataScience<br><br>Today, we are the world’s most popular audio streaming subscription service.
        </div>

        

    
    
    

    <button aria-expanded=""false"" aria-label=""i18n_show_more"" data-tracking-control-name=""public_jobs_show-more-html-btn"" class=""show-more-less-html__button show-more-less-button
        show-more-less-html__button--more
        ml-0.5"">
<!---->
        
            Show more
          

          <icon class=""show-more-less-html__button-icon show-more-less-button-icon lazy-loaded"" aria-hidden=""true"" aria-busy=""false""><svg xmlns=""http://www.w3.org/2000/svg"" width=""16"" height=""16"" preserveAspectRatio=""xMinYMin meet"" focusable=""false"" class=""lazy-loaded"" aria-busy=""false""><path d=""M8 9l5.93-4L15 6.54l-6.15 4.2a1.5 1.5 0 01-1.69 0L1 6.54 2.07 5z"" fill=""currentColor""></path></svg></icon>
    </button>
  

        

    
    
    

    <button aria-expanded=""true"" aria-label=""i18n_show_less"" data-tracking-control-name=""public_jobs_show-less-html-btn"" class=""show-more-less-html__button show-more-less-button
        show-more-less-html__button--less
        ml-0.5"">
<!---->
        
            Show less
          

          <icon class=""show-more-less-html__button-icon show-more-less-button-icon lazy-loaded"" aria-hidden=""true"" aria-busy=""false""><svg xmlns=""http://www.w3.org/2000/svg"" width=""16"" height=""16"" preserveAspectRatio=""xMinYMin meet"" focusable=""false"" class=""lazy-loaded"" aria-busy=""false""><path d=""M8 7l-5.9 4L1 9.5l6.2-4.2c.5-.3 1.2-.3 1.7 0L15 9.5 13.9 11 8 7z"" fill=""currentColor""></path></svg></icon>
    </button>
  
<!---->    </section>
  
      </div>",2024-08-01,[]
