Job_ID,Link,Title,Company,Place,Description,HTML,Date,Skills
4086249119,https://se.linkedin.com/jobs/view/machine-learning-engineer-at-hypertype-4086249119?position=14&pageNum=0&refId=3Nm34KmPa3y0nzpLYnm%2Bwg%3D%3D&trackingId=TqYDQTvPsfcQ%2Fc1FwsdmZw%3D%3D,Machine Learning Engineer,Hypertype,"Stockholm, Stockholm County, Sweden","We are looking for a dynamic and innovative Machine Learning Engineer to join our team. This role is ideal for someone who thrives in a startup environment and is passionate about developing cutting-edge AI solutions. As a Machine Learning Engineer, you will work collaboratively with cross-functional teams to drive our AI initiatives forward.

Company Description

Hypertype is an AI-powered text based communication platform that finds the most relevant information and writes smarter customer emails & live chats, using real-time company data.

305 billion emails sent and received every single day. We live in an information overload era, with ever-changing customer scenarios to process and answer. Customer facing roles still spend 20-30 mins just to find the right answers and draft high quality email, connecting the dots from millions of data sitting inside their company. Our vision is to make the smartest experience for customer communications with data.

Only a single digit % of SMEs has adopted AI in their customer facing teams. We have over 200 paying companies including Mynt, Yazen, Remote and many more.

Our customers proudly recognize us for delivering the ""highest quality answers in the market... outsmarting Gemini, Fin, Microsoft Copilot etc"". —a testament to our unwavering commitment to excellence and precision in every interaction.

Join us on our mission to build the world’s smartest and most accurate AI brain across customer domains and beyond. If you're driven and ready to contribute to something groundbreaking, this is your chance to be part of a mission that is setting new industry standards.

The Position

The ML Engineer is responsible for developing Hyperbrain AI to build the world's smartest and accurate brain for CS and many more domains. Hyperbrain ingests and stores high quality data which is unique for each company. Company data is ingested from omni- data sources into Hyperbrain in one-click. Hyperbrain then automatically writes customer communications with the most relevant data in the reply interfaces e.g. Intercom, Gmail and Outlook, to answer trillions of customer scenarios that is beyond standard Chatbot conversations.

In the role, you will design, develop, and deploy machine learning models that directly impact Hypertype products. You will work closely with customer data, ensuring the models are not only accurate and efficient but also compliant with data privacy regulations.


Developing new product experiences using NLP & LLMs and working closely with customers to understand their needs and ensure successful implementation.
Implementing and shipping state-of-the-art information retrieval systems and search algorithms, with high impact metrics
Improve the quality and accuracy of answers from omni- data sources and format, by incorporating the best data and features to improve AI suggested answers.
Prompt engineering and fine-tuning to improve the quality of customer communications for different scenarios.
Collaborating with cross-functional teams to align technical decisions with business goals and co-develop ML roadmap.
Designing, developing, and maintaining scalable APIs for integrating new data sources.
Collaborate with frontend developers to ensure APIs are efficient, well-documented, and deliver the necessary data for UI/UX components.
Troubleshooting and resolving data-related issues, ensuring continuous data flow and minimal downtime.
Identifying opportunities for performance improvements and proactively implementing solutions to improve the data architecture.
Rapidly integrating new data sources to support POCs and MVPs, working closely with co-founders and the sales team to offer technical expertise throughout the sales process.


Qualification


You have ample experience in in building machine learning pipelines and / or information retrieval systems and are up to speed on latest in NLP & LLMs.
You have experience in developing POC and MVP to facilitate the successful establishment of customer partnerships and the closing of deals.
You have applied knowledge of A/B testing for model evaluation
Versatile Software Engineering Skills: A solid engineering background with a robust foundation in software engineering principles. You have written code for and supported production engineering systems.
Proficient in Python and experience with GCP: our AI stack uses Python, Hugging Face, PyTorch & Elasticsearch and is deployed on GKE.
You care about delivering true business value and solving RAG challenges at the same time.
A Solid Educational Foundation: Bachelor’s degree in Machine Learning, Computer Science or related field; Master’s degree is a plus.


Bonus points


Experience with ETL processes, data pipelines and large-scale data processing.
Familiar with tools like Airbyte, Apache Airflow, or similar.
Experience with Node and Typescript.
Familiar with data security and compliance (e.g., PII handling, ISO 27001, SOC 2, GDPR). Familiarity with the Vanta platform is a strong plus.


The Offer


Opportunity to be part in a generative AI startup before the next AI inflection point.
A role and position that enables you to be part of building and shaping the way how customer information is shared and communicated.
Take part of our journey as we grow to be at the forefront to solve AI challenges and work towards building Hyperbrain AI for every domain for a decision-making AI.
Salary + Equity + Opportunity to grow in the role


At Hypertype, we look for positive, 'always learning' and humble personalities. We welcome everyone to apply if you feel it suits you and let’s have a chat to see if you could be right for the role.
Show more ","<div class=""description__text description__text--rich"">
        
    
    
    

    <section data-max-lines=""5"" class=""show-more-less-html"">
        <div class=""show-more-less-html__markup show-more-less-html__markup--clamp-after-5
            relative overflow-hidden"">
          We are looking for a dynamic and innovative <strong>Machine Learning Engineer</strong> to join our team. This role is ideal for someone who thrives in a startup environment and is passionate about developing cutting-edge AI solutions. As a Machine Learning Engineer, you will work collaboratively with cross-functional teams to drive our AI initiatives forward.<br><br><strong>Company Description<br><br></strong>Hypertype is an AI-powered text based communication platform that finds the most relevant information and writes smarter customer emails &amp; live chats, using real-time company data.<br><br>305 billion emails sent and received every single day. We live in an information overload era, with ever-changing customer scenarios to process and answer. Customer facing roles still spend 20-30 mins just to find the right answers and draft high quality email, connecting the dots from millions of data sitting inside their company. Our vision is to make the smartest experience for customer communications with data.<br><br>Only a single digit % of SMEs has adopted AI in their customer facing teams. We have over 200 paying companies including Mynt, Yazen, Remote and many more.<br><br>Our customers proudly recognize us for delivering the ""highest quality answers in the market... outsmarting Gemini, Fin, Microsoft Copilot etc"". —a testament to our unwavering commitment to excellence and precision in every interaction.<br><br>Join us on our mission to build the world’s smartest and most accurate AI brain across customer domains and beyond. If you're driven and ready to contribute to something groundbreaking, this is your chance to be part of a mission that is setting new industry standards.<br><br><strong>The Position<br><br></strong>The <strong>ML Engineer</strong> is responsible for <strong>developing Hyperbrain AI </strong>to build the world's smartest and accurate brain for CS and many more domains. Hyperbrain ingests and stores high quality data which is unique for each company. Company data is ingested from omni- data sources into Hyperbrain in one-click. Hyperbrain then automatically writes customer communications with the most relevant data in the reply interfaces e.g. Intercom, Gmail and Outlook, to answer trillions of customer scenarios that is beyond standard Chatbot conversations.<br><br>In the role, you will design, develop, and deploy machine learning models that directly impact Hypertype products. You will work closely with customer data, ensuring the models are not only accurate and efficient but also compliant with data privacy regulations.<br><br><ul><li>Developing new product experiences using NLP &amp; LLMs and working closely with customers to understand their needs and ensure successful implementation.</li><li>Implementing and shipping state-of-the-art information retrieval systems and search algorithms, with high impact metrics</li><li>Improve the quality and accuracy of answers from omni- data sources and format, by incorporating the best data and features to improve AI suggested answers.</li><li>Prompt engineering and fine-tuning to improve the quality of customer communications for different scenarios.</li><li>Collaborating with cross-functional teams to align technical decisions with business goals and co-develop ML roadmap.</li><li>Designing, developing, and maintaining scalable APIs for integrating new data sources. </li><li>Collaborate with frontend developers to ensure APIs are efficient, well-documented, and deliver the necessary data for UI/UX components.</li><li>Troubleshooting and resolving data-related issues, ensuring continuous data flow and minimal downtime.</li><li>Identifying opportunities for performance improvements and proactively implementing solutions to improve the data architecture.</li><li>Rapidly integrating new data sources to support POCs and MVPs, working closely with co-founders and the sales team to offer technical expertise throughout the sales process.<br><br></li></ul><strong>Qualification<br><br></strong><ul><li>You have ample experience in in building machine learning pipelines and / or information retrieval systems and are up to speed on latest in NLP &amp; LLMs.</li><li>You have experience in developing POC and MVP to facilitate the successful establishment of customer partnerships and the closing of deals.</li><li>You have applied knowledge of A/B testing for model evaluation</li><li>Versatile Software Engineering Skills: A solid engineering background with a robust foundation in software engineering principles. You have written code for and supported production engineering systems.</li><li>Proficient in Python and experience with GCP: our AI stack uses Python, Hugging Face, PyTorch &amp; Elasticsearch and is deployed on GKE.</li><li>You care about delivering true business value and solving RAG challenges at the same time.</li><li>A Solid Educational Foundation: Bachelor’s degree in Machine Learning, Computer Science or related field; Master’s degree is a plus.<br><br></li></ul><strong>Bonus points<br><br></strong><ul><li>Experience with ETL processes, data pipelines and large-scale data processing.</li><li>Familiar with tools like Airbyte, Apache Airflow, or similar.</li><li>Experience with Node and Typescript.</li><li>Familiar with data security and compliance (e.g., PII handling, ISO 27001, SOC 2, GDPR). Familiarity with the Vanta platform is a strong plus.<br><br></li></ul><strong>The Offer<br><br></strong><ul><li>Opportunity to be part in a generative AI startup before the next AI inflection point.</li><li>A role and position that enables you to be part of building and shaping the way how customer information is shared and communicated.</li><li>Take part of our journey as we grow to be at the forefront to solve AI challenges and work towards building Hyperbrain AI for every domain for a decision-making AI.</li><li>Salary + Equity + Opportunity to grow in the role<br><br></li></ul>At Hypertype, we look for positive, 'always learning' and humble personalities. We welcome everyone to apply if you feel it suits you and let’s have a chat to see if you could be right for the role.
        </div>

        

    
    
    

    <button aria-expanded=""false"" aria-label=""i18n_show_more"" data-tracking-control-name=""public_jobs_show-more-html-btn"" class=""show-more-less-html__button show-more-less-button
        show-more-less-html__button--more
        ml-0.5"">
<!---->
        
            Show more
          

          <icon class=""show-more-less-html__button-icon show-more-less-button-icon lazy-loaded"" aria-hidden=""true"" aria-busy=""false""><svg xmlns=""http://www.w3.org/2000/svg"" width=""16"" height=""16"" preserveAspectRatio=""xMinYMin meet"" focusable=""false"" class=""lazy-loaded"" aria-busy=""false""><path d=""M8 9l5.93-4L15 6.54l-6.15 4.2a1.5 1.5 0 01-1.69 0L1 6.54 2.07 5z"" fill=""currentColor""></path></svg></icon>
    </button>
  

        

    
    
    

    <button aria-expanded=""true"" aria-label=""i18n_show_less"" data-tracking-control-name=""public_jobs_show-less-html-btn"" class=""show-more-less-html__button show-more-less-button
        show-more-less-html__button--less
        ml-0.5"">
<!---->
        
            Show less
          

          <icon class=""show-more-less-html__button-icon show-more-less-button-icon lazy-loaded"" aria-hidden=""true"" aria-busy=""false""><svg xmlns=""http://www.w3.org/2000/svg"" width=""16"" height=""16"" preserveAspectRatio=""xMinYMin meet"" focusable=""false"" class=""lazy-loaded"" aria-busy=""false""><path d=""M8 7l-5.9 4L1 9.5l6.2-4.2c.5-.3 1.2-.3 1.7 0L15 9.5 13.9 11 8 7z"" fill=""currentColor""></path></svg></icon>
    </button>
  
<!---->    </section>
  
      </div>",2024-11-29,[]
4085045811,https://se.linkedin.com/jobs/view/machine-learning-engineer-at-datatonic-4085045811?position=15&pageNum=0&refId=3Nm34KmPa3y0nzpLYnm%2Bwg%3D%3D&trackingId=3VtY5lyrHkFdm3ybUeiGiw%3D%3D,Machine Learning Engineer,Datatonic,"Stockholm, Stockholm County, Sweden","Shape the Future of AI & Data with Us

At Datatonic, we are Google Cloud's premier partner in AI, driving transformation for world-class businesses. We push the boundaries of technology with expertise in machine learning, data engineering, and analytics on Google Cloud. By partnering with us, clients future-proof their operations, unlock actionable insights, and stay ahead of the curve in a rapidly evolving world.

Your Mission

As a Machine Learning Engineer, you'll know how to engineer beautiful code in Python and take pride in what you produce. You'll be an advocate of high-quality engineering and best-practice in production software as well as rapid prototypes.

This position is a hands-on technical role where you will actively collaborate with the team to deliver impactful solutions. Your responsibilities will include contributing to the development of machine learning solutions, participating in project scoping, and working closely with team members to ensure successful delivery of engagements.

To be successful, you will need strong ML & Data Science fundamentals and will know the right tools and approach for each ML use case. You'll be comfortable with model optimisation and deployment tools and practices. Furthermore, you'll also need excellent communication and consulting skills, with the desire to meet real business needs and deliver innovative solutions using AI & Cloud.

What You'll Do


Translating Requirements: Interpret vague requirements and develop models to solve real-world problems.
Data Science: Conduct ML experiments using programming languages with machine learning libraries.
GenAI: Leverage generative AI to develop innovative solutions.
Optimisation: Optimise machine learning solutions for performance and scalability.
Custom Code: Implement tailored machine learning code to meet specific needs.
Data Engineering: Ensure efficient data flow between databases and backend systems.
MLOps: Automate ML workflows, focusing on testing, reproducibility, and feature/metadata storage.
ML Architecture Design: Create machine learning architectures using Google Cloud tools and services.
Engineering Software for Production: Build and deploy production-grade software for machine learning and data-driven solutions.


What You'll Bring


Experience: 1–3 years as a Machine Learning Engineer, preferably with a consulting background.
Programming Skills: Proficiency in Python as a backend language, capable of delivering production-ready code in well-tested CI/CD pipelines.
Cloud Expertise: Familiarity with cloud platforms such as Google Cloud, AWS, or Azure.
Software Engineering: Hands-on experience with foundational software engineering practices.
Database Proficiency: Strong knowledge of SQL for querying and managing data.
Scalability: Experience scaling computations using GPUs or distributed computing systems.
ML Integration: Familiarity with exposing machine learning components through web services or wrappers (e.g., Flask in Python).
Soft Skills: Strong communication and presentation skills to effectively convey technical concepts.


Bonus Points If You Have:


Scale-up experience.


+ Cloud certifications (Google CDL, AWS Solution Architect, etc.).

What's in It for You?

We believe in empowering our team to thrive, with benefits including:


Holiday: 30 days holiday (plus public holidays, obviously!)
Health Perks: 4500 kr per year Healthcare Allowance (paid monthly)
Private Salary Sacrifice Pension
Work from home allowance: 1200 kr
Wellness: Up to 5000 kr per year Wellness Allowance (payable on receipt of invoice)
Learning & Growth: Access to platforms like Udemy to fuel your curiosity.




Why Datatonic?

Join us to work alongside AI enthusiasts and data experts who are shaping tomorrow. At Datatonic, innovation isn't just encouraged - it's embedded in everything we do. If you're ready to inspire change and deliver value at the forefront of data and AI, we'd love to hear from you!

Are you ready to make an impact?

Apply now and take your career to the next level.
Show more ","<div class=""description__text description__text--rich"">
        
    
    
    

    <section data-max-lines=""5"" class=""show-more-less-html"">
        <div class=""show-more-less-html__markup show-more-less-html__markup--clamp-after-5
            relative overflow-hidden"">
          <strong>Shape the Future of AI &amp; Data with Us<br><br></strong>At Datatonic, we are Google Cloud's premier partner in AI, driving transformation for world-class businesses. We push the boundaries of technology with expertise in machine learning, data engineering, and analytics on Google Cloud. By partnering with us, clients future-proof their operations, unlock actionable insights, and stay ahead of the curve in a rapidly evolving world.<br><br><strong>Your Mission<br><br></strong>As a Machine Learning Engineer, you'll know how to engineer beautiful code in Python and take pride in what you produce. You'll be an advocate of high-quality engineering and best-practice in production software as well as rapid prototypes.<br><br>This position is a hands-on technical role where you will actively collaborate with the team to deliver impactful solutions. Your responsibilities will include contributing to the development of machine learning solutions, participating in project scoping, and working closely with team members to ensure successful delivery of engagements.<br><br>To be successful, you will need strong ML &amp; Data Science fundamentals and will know the right tools and approach for each ML use case. You'll be comfortable with model optimisation and deployment tools and practices. Furthermore, you'll also need excellent communication and consulting skills, with the desire to meet real business needs and deliver innovative solutions using AI &amp; Cloud.<br><br><strong>What You'll Do<br><br></strong><ul><li>Translating Requirements: Interpret vague requirements and develop models to solve real-world problems.</li><li>Data Science: Conduct ML experiments using programming languages with machine learning libraries.</li><li>GenAI: Leverage generative AI to develop innovative solutions.</li><li>Optimisation: Optimise machine learning solutions for performance and scalability.</li><li>Custom Code: Implement tailored machine learning code to meet specific needs.</li><li>Data Engineering: Ensure efficient data flow between databases and backend systems.</li><li>MLOps: Automate ML workflows, focusing on testing, reproducibility, and feature/metadata storage.</li><li>ML Architecture Design: Create machine learning architectures using Google Cloud tools and services.</li><li>Engineering Software for Production: Build and deploy production-grade software for machine learning and data-driven solutions.<br><br></li></ul><strong>What You'll Bring<br><br></strong><ul><li>Experience: 1–3 years as a Machine Learning Engineer, preferably with a consulting background.</li><li>Programming Skills: Proficiency in Python as a backend language, capable of delivering production-ready code in well-tested CI/CD pipelines.</li><li>Cloud Expertise: Familiarity with cloud platforms such as Google Cloud, AWS, or Azure.</li><li>Software Engineering: Hands-on experience with foundational software engineering practices.</li><li>Database Proficiency: Strong knowledge of SQL for querying and managing data.</li><li>Scalability: Experience scaling computations using GPUs or distributed computing systems.</li><li>ML Integration: Familiarity with exposing machine learning components through web services or wrappers (e.g., Flask in Python).</li><li>Soft Skills: Strong communication and presentation skills to effectively convey technical concepts.<br><br></li></ul><strong>Bonus Points If You Have:<br><br></strong><ul><li>Scale-up experience.<br><br></li></ul><strong>+</strong> Cloud certifications (Google CDL, AWS Solution Architect, etc.).<br><br><strong>What's in It for You?<br><br></strong>We believe in empowering our team to thrive, with benefits including:<br><br><ul><li>Holiday: 30 days holiday (plus public holidays, obviously!)</li><li>Health Perks: 4500 kr per year Healthcare Allowance (paid monthly)</li><li>Private Salary Sacrifice Pension</li><li>Work from home allowance: 1200 kr</li><li>Wellness: Up to 5000 kr per year Wellness Allowance (payable on receipt of invoice)</li><li>Learning &amp; Growth: Access to platforms like Udemy to fuel your curiosity.<br><br><br><br></li></ul><strong>Why Datatonic?<br><br></strong>Join us to work alongside AI enthusiasts and data experts who are shaping tomorrow. At Datatonic, innovation isn't just encouraged - it's embedded in everything we do. If you're ready to inspire change and deliver value at the forefront of data and AI, we'd love to hear from you!<br><br>Are you ready to make an impact?<br><br><strong>Apply now and take your career to the next level.</strong>
        </div>

        

    
    
    

    <button aria-expanded=""false"" aria-label=""i18n_show_more"" data-tracking-control-name=""public_jobs_show-more-html-btn"" class=""show-more-less-html__button show-more-less-button
        show-more-less-html__button--more
        ml-0.5"">
<!---->
        
            Show more
          

          <icon class=""show-more-less-html__button-icon show-more-less-button-icon lazy-loaded"" aria-hidden=""true"" aria-busy=""false""><svg xmlns=""http://www.w3.org/2000/svg"" width=""16"" height=""16"" preserveAspectRatio=""xMinYMin meet"" focusable=""false"" class=""lazy-loaded"" aria-busy=""false""><path d=""M8 9l5.93-4L15 6.54l-6.15 4.2a1.5 1.5 0 01-1.69 0L1 6.54 2.07 5z"" fill=""currentColor""></path></svg></icon>
    </button>
  

        

    
    
    

    <button aria-expanded=""true"" aria-label=""i18n_show_less"" data-tracking-control-name=""public_jobs_show-less-html-btn"" class=""show-more-less-html__button show-more-less-button
        show-more-less-html__button--less
        ml-0.5"">
<!---->
        
            Show less
          

          <icon class=""show-more-less-html__button-icon show-more-less-button-icon lazy-loaded"" aria-hidden=""true"" aria-busy=""false""><svg xmlns=""http://www.w3.org/2000/svg"" width=""16"" height=""16"" preserveAspectRatio=""xMinYMin meet"" focusable=""false"" class=""lazy-loaded"" aria-busy=""false""><path d=""M8 7l-5.9 4L1 9.5l6.2-4.2c.5-.3 1.2-.3 1.7 0L15 9.5 13.9 11 8 7z"" fill=""currentColor""></path></svg></icon>
    </button>
  
<!---->    </section>
  
      </div>",2024-11-29,[]
