Job_ID,Link,Title,Company,Place,Description,HTML,Date,Skills
4260822828,https://es.linkedin.com/jobs/view/junior-data-scientist-at-coverwallet-an-aon-company-4260822828?position=2&pageNum=0&refId=Nuw0Brh8D%2BLJ25pPoIGNYA%3D%3D&trackingId=OKJyTHx%2B4kDVmoUiFc4yvA%3D%3D,Junior Data Scientist,"CoverWallet, an Aon company","Madrid, Community of Madrid, Spain","Who we are

At CoverWallet we are determined to revolutionize the insurance industry! We launched in 2015 and since then we are the leading digital platform for contracting insurance for small and medium-sized companies. Thanks to state-of-the-art technology and meticulous design we have turned insurance management and processing into a simple, fast and convenient process for our clients. All online, in minutes!




Our passion is in delivering innovation and value creation through technology, and our mission is to become the world’s leading InsurTech. For this, we have built an incredible team of ~800 people based in New York, Spain, Poland and Singapore. Success is guaranteed as we are part of Aon, the global leaders in risk, retirement and health solutions with 50,000 colleagues worldwide. We combine the mindset and culture of a high-growth startup with the backing and support of a global multinational. The best of both worlds in one company - what more could we ask for?




What you will do

We are looking for a motivated and curious Junior Data Scientist to join our high-impact Data Science team. This is an excellent opportunity for an early-career professional to grow technical skills and apply data science to solve real business problems. You will collaborate closely with experienced data scientists, data engineers, and business stakeholders to support analytics initiatives and contribute to building data-driven solutions. If you are passionate about data, eager to learn, and excited to apply statistical and machine learning techniques to real-world challenges, we’d love to meet you.




A typical day

Support the development of data science solutions, including exploratory analyses, predictive models, and reporting tools.
Collaborate with senior team members to deliver insights that inform product, marketing, operations, and strategic decisions.
Participate in the design, execution, and analysis of experiments (e.g., A/B testing).
Contribute to the development and maintenance of data pipelines and feature engineering workflows.
Assist in building, evaluating, and deploying machine learning models under the guidance of senior data scientists.
Communicate data-driven findings through clear reports, visualizations, and presentations for both technical and non-technical audiences.
Follow best practices for coding, documentation, and version control.
Work with cross-functional teams, including product managers, engineers, and analysts, to ensure solutions meet business needs.
Stay up to date with new tools, methodologies, and industry trends in data science and machine learning.




What you need to succeed

Bachelor’s or Master’s degree in Data Science, Computer Science, Statistics, Mathematics, Engineering, or a related field.
1-2 years of professional experience in data science, analytics, or related roles (internships and academic projects count!)
Strong analytical mindset with excellent problem-solving skills.
Solid foundation in Python for data analysis and modeling.
Proficiency in SQL and working with structured data.
Basic understanding of statistical concepts, hypothesis testing, and machine learning fundamentals.
Familiarity with data visualization tools (e.g., Matplotlib, Seaborn, or equivalent).
Enthusiasm for learning new technologies, frameworks, and methodologies.
Good communication skills and the ability to present results clearly.
Experience working on projects either through coursework, internships, or personal projects.
Ability to thrive in a collaborative, fast-paced environment.




Bonus Points For

Experience with cloud platforms such as Google Cloud, AWS, or Azure.
Familiarity with version control tools like Git.
Exposure to machine learning libraries such as scikit-learn, TensorFlow, or PyTorch.
Understanding of basic MLOps concepts or pipelines.
Knowledge of Jupyter Notebooks and data storytelling practices.




About the recruitment process

Your first contact with CoverWallet will be through an HR interview with one of our colleagues from the Talent Acquisition area, who will tell you everything about our company and its history, as well as the details of the position, functions and your future conditions. We would love to know your professional and academic career, and of course, your motivations and expectations for a new professional project. We will be happy to answer all your questions!
Do we have a match? Let’s move on to your First Technical Interview! You will meet two of the colleagues from the Data Science team, who will explain to you in more detail what the team's day-to-day life is and its responsibilities. They will be very interested in expanding information about your experience as a Data Scientist as well as your knowledge of our main technological environments.
If everything has gone well and you have impressed our colleagues... we advance to the second stage of the process! We will send you a data challenge based on a case study to find out your technical level and you will have a maximum of 7 days to complete it.
If you've made it this far, things are getting interesting... It's time for your Final Interview! In this case, you will have the opportunity to meet one of our Heads of Data and Engineering, who will close the selection process with an interview aimed at getting to know you not only on a professional and technical level, but also on a personal level, so that both of you can reach the conclusion of whether the purpose of our project fits with your professional aspirations.




Why CoverWallet

At CoverWallet you will have the opportunity to be a key player in the transformation of one of the largest industries and in one of the most developed digital markets in the world. You will work in a cutting-edge tech environment, alongside a super powerful and diverse global team. Join us and build your own career plan in one of the world's leading companies, tailored to your dreams and aspirations! And just for good measure…




💰 Competitive salary based on your background and experience, and a variable annual bonus set according to your goals
⏰ Enjoy flexible working hours and find out your ideal way of working thanks to our smart work model: full remote or hybrid, it’s up to you!
🎁 Perks package consisting of a Company-paid Life, Accident Insurance and Medical Cover with free dental care. Complement your benefits with our flexible compensation plan (tickets restaurant, transport card, daycare checks, external training and even a Pension Scheme!)
📚 Carry on with your training thanks to your additional budget of 1,500€ per year to finance training courses, certifications, books or any teaching aids that will help you continue to grow professionally
🛒 Enjoy a lot of offers and save on your purchases thanks to our discount platform (BigPocket) on your favorite brands (travel, fashion, technology, leisure...)
🏝 23 paid vacation days per year, plus 2 additional personal days and 2 wellbeing days to focus on your own health and prioritize self-care :)
🍏 Great offices in Madrid, Valencia and Sevilla. Come and enjoy all the activities we do, both inside and outside the office (hackathons, meetups, tech talks, code katas and much more!)
Show more ","<div class=""description__text description__text--rich"">
        
    
    
    

    <section data-max-lines=""5"" class=""show-more-less-html"">
        <div class=""show-more-less-html__markup show-more-less-html__markup--clamp-after-5
            relative overflow-hidden"">
          <p><strong>Who we are</strong></p><p>At CoverWallet we are determined to revolutionize the insurance industry! We launched in 2015 and since then we are <strong>the leading digital platform for contracting insurance</strong> for small and medium-sized companies. Thanks to state-of-the-art technology and meticulous design we have turned insurance management and processing into a simple, fast and convenient process for our clients. All online, in minutes!</p><p><br></p><p>Our passion is in delivering innovation and value creation through technology, and our mission is to become <strong>the world’s leading InsurTech</strong>. For this, we have built an incredible <strong>team of ~800 people</strong> based in New York, Spain, Poland and Singapore. Success is guaranteed as we are part of <strong>Aon</strong>, the global leaders in risk, retirement and health solutions with 50,000 colleagues worldwide. We combine the mindset and culture of a high-growth startup with the backing and support of a global multinational. The best of both worlds in one company - what more could we ask for?</p><p><br></p><p><strong>What you will do</strong></p><p>We are looking for a motivated and curious <strong>Junior Data Scientist</strong> to join our high-impact Data Science team. This is an excellent opportunity for an early-career professional to grow technical skills and apply data science to solve real business problems. You will collaborate closely with experienced data scientists, data engineers, and business stakeholders to support analytics initiatives and contribute to building data-driven solutions. If you are passionate about data, eager to learn, and excited to apply statistical and machine learning techniques to real-world challenges, we’d love to meet you.</p><p><br></p><p><strong>A typical day</strong></p><ul><li>Support the development of data science solutions, including exploratory analyses, predictive models, and reporting tools.</li><li>Collaborate with senior team members to deliver insights that inform product, marketing, operations, and strategic decisions.</li><li>Participate in the design, execution, and analysis of experiments (e.g., A/B testing).</li><li>Contribute to the development and maintenance of data pipelines and feature engineering workflows.</li><li>Assist in building, evaluating, and deploying machine learning models under the guidance of senior data scientists.</li><li>Communicate data-driven findings through clear reports, visualizations, and presentations for both technical and non-technical audiences.</li><li>Follow best practices for coding, documentation, and version control.</li><li>Work with cross-functional teams, including product managers, engineers, and analysts, to ensure solutions meet business needs.</li><li>Stay up to date with new tools, methodologies, and industry trends in data science and machine learning.</li></ul><p><br></p><p><strong>What you need to succeed</strong></p><ul><li>Bachelor’s or Master’s degree in Data Science, Computer Science, Statistics, Mathematics, Engineering, or a related field.</li><li>1-2 years of professional experience in data science, analytics, or related roles (internships and academic projects count!)</li><li>Strong analytical mindset with excellent problem-solving skills.</li><li>Solid foundation in Python for data analysis and modeling.</li><li>Proficiency in SQL and working with structured data.</li><li>Basic understanding of statistical concepts, hypothesis testing, and machine learning fundamentals.</li><li>Familiarity with data visualization tools (e.g., Matplotlib, Seaborn, or equivalent).</li><li>Enthusiasm for learning new technologies, frameworks, and methodologies.</li><li>Good communication skills and the ability to present results clearly.</li><li>Experience working on projects either through coursework, internships, or personal projects.</li><li>Ability to thrive in a collaborative, fast-paced environment.</li></ul><p><br></p><p><strong>Bonus Points For</strong></p><ul><li>Experience with cloud platforms such as Google Cloud, AWS, or Azure.</li><li>Familiarity with version control tools like Git.</li><li>Exposure to machine learning libraries such as scikit-learn, TensorFlow, or PyTorch.</li><li>Understanding of basic MLOps concepts or pipelines.</li><li>Knowledge of Jupyter Notebooks and data storytelling practices.</li></ul><p><br></p><p><strong>About the recruitment process</strong></p><ul><li>Your first contact with CoverWallet will be through an <strong>HR interview</strong> with one of our colleagues from the Talent Acquisition area, who will tell you everything about our company and its history, as well as the details of the position, functions and your future conditions. We would love to know your professional and academic career, and of course, your motivations and expectations for a new professional project. We will be happy to answer all your questions!</li><li>Do we have a match? Let’s move on to your <strong>First Technical Interview</strong>! You will meet two of the colleagues from the Data Science team, who will explain to you in more detail what the team's day-to-day life is and its responsibilities. They will be very interested in expanding information about your experience as a Data Scientist as well as your knowledge of our main technological environments.</li><li>If everything has gone well and you have impressed our colleagues... we advance to the <strong>second stage of the process</strong>! We will send you a data challenge based on a case study to find out your technical level and you will have a maximum of 7 days to complete it.</li><li>If you've made it this far, things are getting interesting... It's time for your <strong>Final Interview</strong>! In this case, you will have the opportunity to meet one of our Heads of Data and Engineering, who will close the selection process with an interview aimed at getting to know you not only on a professional and technical level, but also on a personal level, so that both of you can reach the conclusion of whether the purpose of our project fits with your professional aspirations.</li></ul><p><br></p><p><strong>Why CoverWallet</strong></p><p>At CoverWallet you will have the opportunity to be a key player in the transformation of one of the largest industries and in one of the most developed digital markets in the world. You will work in a cutting-edge tech environment, alongside a super powerful and diverse global team. Join us and build your own <strong>career plan</strong> in one of the world's leading companies, tailored to your dreams and aspirations! And just for good measure…</p><p><br></p><ul><li>💰 <strong>Competitive salary</strong> based on your background and experience, and a <strong>variable annual bonus</strong> set according to your goals</li><li>⏰ Enjoy <strong>flexible working hours</strong> and find out your ideal way of working thanks to our <strong>smart work model</strong>: full remote or hybrid, it’s up to you!</li><li>🎁 <strong>Perks package</strong> consisting of a Company-paid Life, Accident Insurance and Medical Cover with free dental care. Complement your benefits with our <strong>flexible compensation plan</strong> (tickets restaurant, transport card, daycare checks, external training and even a Pension Scheme!)</li><li>📚 Carry on with your training thanks to your additional <strong>budget of 1,500€</strong> per year to finance training courses, certifications, books or any teaching aids that will help you continue to grow professionally</li><li>🛒 Enjoy a lot of offers and save on your purchases thanks to our <strong>discount platform (BigPocket)</strong> on your favorite brands (travel, fashion, technology, leisure...)</li><li>🏝 <strong>23 paid vacation days per year</strong>, plus 2 additional personal days and 2 wellbeing days to focus on your own health and prioritize self-care :)</li><li>🍏 <strong>Great offices </strong>in Madrid, Valencia and Sevilla. Come and enjoy all the activities we do, both inside and outside the office (hackathons, meetups, tech talks, code katas and much more!)</li></ul>
        </div>

        

    
    
    

    <button aria-expanded=""false"" aria-label=""Show more"" data-tracking-control-name=""public_jobs_show-more-html-btn"" class=""show-more-less-html__button show-more-less-button
        show-more-less-html__button--more
        ml-0.5"">
<!---->
        
            Show more
          

          <icon data-delayed-url=""https://static.licdn.com/aero-v1/sc/h/cyolgscd0imw2ldqppkrb84vo"" class=""show-more-less-html__button-icon show-more-less-button-icon""></icon>
    </button>
  

        

    
    
    

    <button aria-expanded=""true"" aria-label=""Show less"" data-tracking-control-name=""public_jobs_show-less-html-btn"" class=""show-more-less-html__button show-more-less-button
        show-more-less-html__button--less
        ml-0.5"">
<!---->
        
            Show less
          

          <icon class=""show-more-less-html__button-icon show-more-less-button-icon lazy-loaded"" aria-hidden=""true"" aria-busy=""false""><svg xmlns=""http://www.w3.org/2000/svg"" width=""16"" height=""16"" preserveAspectRatio=""xMinYMin meet"" focusable=""false"" class=""lazy-loaded"" aria-busy=""false""><path d=""M8 7l-5.9 4L1 9.5l6.2-4.2c.5-.3 1.2-.3 1.7 0L15 9.5 13.9 11 8 7z"" fill=""currentColor""></path></svg></icon>
    </button>
  
<!---->    </section>
  
      </div>",2025-07-02,[]
4259430606,https://pt.linkedin.com/jobs/view/data-scientist-at-volkswagen-digital-solutions-4259430606?position=1&pageNum=0&refId=H22KnNGu7FQBqEpKTzS1dA%3D%3D&trackingId=nzoA%2FzG3dYYq60s8BFGF9Q%3D%3D,Data Scientist,Volkswagen Digital Solutions,"Lisboa, Lisbon, Portugal","You’ll be focused in


Collaborating with stakeholders across the organization to identify opportunities to leverage data for impactful business solutions.
Extracting and analyze data from company databases to drive optimization and enhance product development.
Designing and implement custom data models and algorithms tailored to various data sets.
Applying predictive modeling to improve customer experience and drive business outcomes.
Building processes and tools to monitor model performance and ensure data accuracy.



In order to succeed, you’ll need


Academic background in Business Administration or a related field.
Proficiency in statistical programming languages (e.g., Python, SQL) for data manipulation and insight generation.
Experience designing and working with data architectures.
Solid understanding of machine learning techniques such as clustering, decision trees, and neural networks.
Strong grasp of advanced statistical methods, including regression, statistical distributions and testing.
Strong communication and analytical skills
Great English skills, both written and spoken.



About The Product

Our Sales Spoke team is driven by a data-first culture, leveraging both advanced analytics and AI to empower our team and customers to create additional value. We enable our business units to explore their untapped data & analytics potential and provide our customers with value-adding advanced analytics solutions.
Show more ","<div class=""description__text description__text--rich"">
        
    
    
    

    <section data-max-lines=""5"" class=""show-more-less-html"">
        <div class=""show-more-less-html__markup show-more-less-html__markup--clamp-after-5
            relative overflow-hidden"">
          <strong>You’ll be focused in <br><br></strong><ul><li> Collaborating with stakeholders across the organization to identify opportunities to leverage data for impactful business solutions.</li><li> Extracting and analyze data from company databases to drive optimization and enhance product development.</li><li> Designing and implement custom data models and algorithms tailored to various data sets.</li><li> Applying predictive modeling to improve customer experience and drive business outcomes.</li><li> Building processes and tools to monitor model performance and ensure data accuracy.<br><br><br></li></ul><strong>In order to succeed, you’ll need<br><br></strong><ul><li> Academic background in Business Administration or a related field.</li><li> Proficiency in statistical programming languages (e.g., Python, SQL) for data manipulation and insight generation.</li><li> Experience designing and working with data architectures.</li><li> Solid understanding of machine learning techniques such as clustering, decision trees, and neural networks.</li><li> Strong grasp of advanced statistical methods, including regression, statistical distributions and testing.</li><li> Strong communication and analytical skills</li><li> Great English skills, both written and spoken.<br><br><br></li></ul><strong>About The Product<br><br></strong>Our Sales Spoke team is driven by a data-first culture, leveraging both advanced analytics and AI to empower our team and customers to create additional value. We enable our business units to explore their untapped data &amp; analytics potential and provide our customers with value-adding advanced analytics solutions.
        </div>

        

    
    
    

    <button aria-expanded=""false"" aria-label=""Show more"" data-tracking-control-name=""public_jobs_show-more-html-btn"" class=""show-more-less-html__button show-more-less-button
        show-more-less-html__button--more
        ml-0.5"">
<!---->
        
            Show more
          

          <icon class=""show-more-less-html__button-icon show-more-less-button-icon lazy-loaded"" aria-hidden=""true"" aria-busy=""false""><svg xmlns=""http://www.w3.org/2000/svg"" width=""16"" height=""16"" preserveAspectRatio=""xMinYMin meet"" focusable=""false"" class=""lazy-loaded"" aria-busy=""false""><path d=""M8 9l5.93-4L15 6.54l-6.15 4.2a1.5 1.5 0 01-1.69 0L1 6.54 2.07 5z"" fill=""currentColor""></path></svg></icon>
    </button>
  

        

    
    
    

    <button aria-expanded=""true"" aria-label=""Show less"" data-tracking-control-name=""public_jobs_show-less-html-btn"" class=""show-more-less-html__button show-more-less-button
        show-more-less-html__button--less
        ml-0.5"">
<!---->
        
            Show less
          

          <icon class=""show-more-less-html__button-icon show-more-less-button-icon lazy-loaded"" aria-hidden=""true"" aria-busy=""false""><svg xmlns=""http://www.w3.org/2000/svg"" width=""16"" height=""16"" preserveAspectRatio=""xMinYMin meet"" focusable=""false"" class=""lazy-loaded"" aria-busy=""false""><path d=""M8 7l-5.9 4L1 9.5l6.2-4.2c.5-.3 1.2-.3 1.7 0L15 9.5 13.9 11 8 7z"" fill=""currentColor""></path></svg></icon>
    </button>
  
<!---->    </section>
  
      </div>",2025-06-30,[]
