Job_ID,Link,Title,Company,Place,Description,HTML,Date,Skills
4210301444,https://www.linkedin.com/jobs/view/sr-bi-data-analytics-engineer-at-nintendo-4210301444?position=1&pageNum=0&refId=1i96IKdUcB3M6I4FTEqGqg%3D%3D&trackingId=Gw1h6HZ9EcEKZDpNX3uEGA%3D%3D,Sr BI Data Analytics Engineer,Nintendo,"Redmond, WA","Nintendo of America Inc.

About Nintendo of America: From the launch of the Nintendo Entertainment System™ more than 30 years ago, Nintendo’s mission has been to create smiles through unique entertainment experiences. Here at Nintendo of America Inc., we deliver on this mission by partnering closely with Nintendo Co., Ltd., to bring Nintendo’s iconic and cherished franchises including Mario™, Donkey Kong™, The Legend of Zelda™, Metroid™, Animal Crossing™, Pikmin™ and Splatoon™ across the Americas through our video games, hardware systems, and collaborations with partners on a range of other entertainment initiatives like feature films and theme parks.

Based in Redmond, Wash., Nintendo of America serves as headquarters for Nintendo’s operations in the Americas. We are an equal opportunity employer offering a welcoming and inclusive environment in service to one another, our products, and the diverse consumers and communities we call home. For more information about Nintendo, please visit the company’s website at https://www.nintendo.com/.

Develops and maintains medium to complex data warehouse ETL (Extraction, Transformation and Loading), reporting, and analytic tasks for Nintendo global consumer contact centers.

Description Of Duties


Designs, develops, and maintains ETL routines and reporting with agreed-upon Service Level Agreements (SLAs) using Microsoft SQL Server, Excel, and Tableau.
Creates data extraction procedures and analytical products to measure, track and improve agent quality, contact center efficiency and outsourced vendor performance.
Provides expertise working with existing team (contract and FTEs) to create business intelligence stored procedures and reports, including design, development and management of a data warehouse environment used for analytics and reporting.
Understands the needs of the business and translates those into meaningful reporting that allows for actionable decisions.
Ensures the generation of standard or custom reports summarizing operational and financial data and Key Performance Indicators (KPIs) for review by executives, managers, clients, and other stakeholders.
Identifies and recommends changes to optimize the ETL environment, implement monitoring, quality and validation processes to ensure data accuracy and integrity.
Conducts or coordinates unit and system tests ensuring intelligence is consistent with defined needs.
Designs and deploys database table structures, reports, and queries.
Supports implemented BI solutions by monitoring and tuning queries and data loads, addressing user questions concerning data integrity, monitoring performance, and communicating functional and technical issues.
Documents specifications for Data Warehouse (DWH) extracts, reports, dashboards, or other outputs.
Facilitates and leads project planning and execution with cross functional teams across the organization.
Works with business and engineering managers to prioritize the project stream, aid roadmap definition and identify project dependencies.
Administers reporting systems including user/role provisioning, deployments and change control.
Conducts comparison processes to identify and develop process improvements; provides recommendations on next steps and manages deliverables.


Summary Of Requirements


Minimum of 5 years of relevant experience in developing data warehousing solutions, dashboards, scorecards, and analytics.
Proficient in writing T-SQL code, SSIS packages, and Stored Procedures on Microsoft SQL Server.
Proficient in writing C# routines to extract data from various physical and cloud databases/data lakes through API calls.
Experience working as a database report developer to deliver BI to business users using Tableau or similar tool.
Familiarity with Operations KPI's and contact center forecasting.
Working knowledge of cloud data architectures like Snowflake.
Experience designing and deploying normalized and dimensional database objects (eg. star schemas).
Extensive reporting experience within an ETL based data migration paradigm.
Excellent native SQL skills; comfortable using a data access tool such as Toad or SSMS.
Share Point, Power BI, Excel macro, Windows script development experience (preferred).
Ability to analyze trends in metrics and suggest Dashboard layouts (preferred).
Customer Service, Operations, Retail, CRM, or B2C e-commerce background a plus.
Requires in-depth conceptual and practical knowledge in own technical job family and basic knowledge of related technical job families; has worked with a range of technologies.
Undergraduate degree or equivalent work experience in computer science, information systems, or other quantitative field.


Applicants must be legally eligible to work in the United States to be considered. Visa sponsorship is not available for this role

This position includes a base salary range of $137,000 - $246,500 annually, potential for a semi-annual discretionary performance bonus, and a comprehensive benefits package that includes medical, dental, vision, 401(k), and paid time off. Please see our Benefits & Perks page for more benefits information. Fixed term employees are eligible for all listed employee benefits except tuition reimbursement.


Show more ","<div class=""description__text description__text--rich"">
        
    
    
    

    <section data-max-lines=""5"" class=""show-more-less-html"">
        <div class=""show-more-less-html__markup show-more-less-html__markup--clamp-after-5
            relative overflow-hidden"">
          <strong>Nintendo of America Inc.<br><br></strong><strong>About Nintendo of America</strong>: From the launch of the Nintendo Entertainment System™ more than 30 years ago, Nintendo’s mission has been to create smiles through unique entertainment experiences. Here at Nintendo of America Inc., we deliver on this mission by partnering closely with Nintendo Co., Ltd., to bring Nintendo’s iconic and cherished franchises including <em>Mario</em>™, <em>Donkey Kong</em>™, <em>The Legend of Zelda</em>™, <em>Metroid</em>™, <em>Animal Crossing</em>™, <em>Pikmin</em>™ and <em>Splatoon</em>™ across the Americas through our video games, hardware systems, and collaborations with partners on a range of other entertainment initiatives like feature films and theme parks.<br><br>Based in Redmond, Wash., Nintendo of America serves as headquarters for Nintendo’s operations in the Americas. We are an equal opportunity employer offering a welcoming and inclusive environment in service to one another, our products, and the diverse consumers and communities we call home. For more information about Nintendo, please visit the company’s website at https://www.nintendo.com/.<br><br>Develops and maintains medium to complex data warehouse ETL (Extraction, Transformation and Loading), reporting, and analytic tasks for Nintendo global consumer contact centers.<br><br><strong>Description Of Duties<br><br></strong><ul><li>Designs, develops, and maintains ETL routines and reporting with agreed-upon Service Level Agreements (SLAs) using Microsoft SQL Server, Excel, and Tableau.</li><li>Creates data extraction procedures and analytical products to measure, track and improve agent quality, contact center efficiency and outsourced vendor performance.</li><li>Provides expertise working with existing team (contract and FTEs) to create business intelligence stored procedures and reports, including design, development and management of a data warehouse environment used for analytics and reporting.</li><li>Understands the needs of the business and translates those into meaningful reporting that allows for actionable decisions.</li><li>Ensures the generation of standard or custom reports summarizing operational and financial data and Key Performance Indicators (KPIs) for review by executives, managers, clients, and other stakeholders.</li><li>Identifies and recommends changes to optimize the ETL environment, implement monitoring, quality and validation processes to ensure data accuracy and integrity.</li><li>Conducts or coordinates unit and system tests ensuring intelligence is consistent with defined needs.</li><li>Designs and deploys database table structures, reports, and queries.</li><li>Supports implemented BI solutions by monitoring and tuning queries and data loads, addressing user questions concerning data integrity, monitoring performance, and communicating functional and technical issues.</li><li>Documents specifications for Data Warehouse (DWH) extracts, reports, dashboards, or other outputs.</li><li>Facilitates and leads project planning and execution with cross functional teams across the organization.</li><li>Works with business and engineering managers to prioritize the project stream, aid roadmap definition and identify project dependencies.</li><li>Administers reporting systems including user/role provisioning, deployments and change control.</li><li>Conducts comparison processes to identify and develop process improvements; provides recommendations on next steps and manages deliverables.<br><br></li></ul><strong>Summary Of Requirements<br><br></strong><ul><li>Minimum of 5 years of relevant experience in developing data warehousing solutions, dashboards, scorecards, and analytics.</li><li>Proficient in writing T-SQL code, SSIS packages, and Stored Procedures on Microsoft SQL Server.</li><li>Proficient in writing C# routines to extract data from various physical and cloud databases/data lakes through API calls.</li><li>Experience working as a database report developer to deliver BI to business users using Tableau or similar tool.</li><li>Familiarity with Operations KPI's and contact center forecasting.</li><li>Working knowledge of cloud data architectures like Snowflake.</li><li>Experience designing and deploying normalized and dimensional database objects (eg. star schemas).</li><li>Extensive reporting experience within an ETL based data migration paradigm.</li><li>Excellent native SQL skills; comfortable using a data access tool such as Toad or SSMS.</li><li>Share Point, Power BI, Excel macro, Windows script development experience (preferred).</li><li>Ability to analyze trends in metrics and suggest Dashboard layouts (preferred).</li><li>Customer Service, Operations, Retail, CRM, or B2C e-commerce background a plus.</li><li>Requires in-depth conceptual and practical knowledge in own technical job family and basic knowledge of related technical job families; has worked with a range of technologies.</li><li>Undergraduate degree or equivalent work experience in computer science, information systems, or other quantitative field.<br><br></li></ul><strong>Applicants must be legally eligible to work in the United States to be considered. Visa sponsorship is not available for this role<br><br></strong>This position includes a base salary range of $137,000 - $246,500 annually, potential for a semi-annual discretionary performance bonus, and a comprehensive benefits package that includes medical, dental, vision, 401(k), and paid time off. Please see our Benefits &amp; Perks page for more benefits information. Fixed term employees are eligible for all listed employee benefits except tuition reimbursement.<br><br>
        </div>

        

    
    
    

    <button aria-expanded=""false"" aria-label=""Show more"" data-tracking-control-name=""public_jobs_show-more-html-btn"" class=""show-more-less-html__button show-more-less-button
        show-more-less-html__button--more
        ml-0.5"">
<!---->
        
            Show more
          

          <icon class=""show-more-less-html__button-icon show-more-less-button-icon lazy-loaded"" aria-hidden=""true"" aria-busy=""false""><svg xmlns=""http://www.w3.org/2000/svg"" width=""16"" height=""16"" preserveAspectRatio=""xMinYMin meet"" focusable=""false"" class=""lazy-loaded"" aria-busy=""false""><path d=""M8 9l5.93-4L15 6.54l-6.15 4.2a1.5 1.5 0 01-1.69 0L1 6.54 2.07 5z"" fill=""currentColor""></path></svg></icon>
    </button>
  

        

    
    
    

    <button aria-expanded=""true"" aria-label=""Show less"" data-tracking-control-name=""public_jobs_show-less-html-btn"" class=""show-more-less-html__button show-more-less-button
        show-more-less-html__button--less
        ml-0.5"">
<!---->
        
            Show less
          

          <icon class=""show-more-less-html__button-icon show-more-less-button-icon lazy-loaded"" aria-hidden=""true"" aria-busy=""false""><svg xmlns=""http://www.w3.org/2000/svg"" width=""16"" height=""16"" preserveAspectRatio=""xMinYMin meet"" focusable=""false"" class=""lazy-loaded"" aria-busy=""false""><path d=""M8 7l-5.9 4L1 9.5l6.2-4.2c.5-.3 1.2-.3 1.7 0L15 9.5 13.9 11 8 7z"" fill=""currentColor""></path></svg></icon>
    </button>
  
<!---->    </section>
  
      </div>",2025-05-28,[]
