Job_ID,Link,Title,Company,Place,Description,HTML,Date,Skills
4070632048,https://www.linkedin.com/jobs/view/data-analyst-data-analytics-governance-at-johnson-johnson-4070632048?position=20&pageNum=0&refId=c5Es4ELoYoc%2FGVJRD9HHmg%3D%3D&trackingId=5mkircjmsuOtfqY%2FagO8VQ%3D%3D,Data Analyst - Data Analytics & Governance,Johnson & Johnson,"Danvers, MA","Abiomed is recruiting for a Data Analyst - Data Analytics & Governance, located in Danvers, MA or Aachen, Germany.

At Johnson & Johnson, we believe health is everything. Our strength in healthcare innovation empowers us to build a world where complex diseases are prevented, treated, and cured, where treatments are smarter and less invasive, and solutions are personal. Through our expertise in Innovative Medicine and MedTech, we are uniquely positioned to innovate across the full spectrum of healthcare solutions today to deliver the breakthroughs of tomorrow, and profoundly impact health for humanity. Learn more at https://www.jnj.com/.

I Am Abiomed | I Am Heart Recovery | Patients First!

Data Analytics & Governance is the team that empowers and enables the Global Procurement Organization via centralized and streamlined solutions for swift, data-driven decisions with the ambition to successfully support the Global Procurement vision and better serve our patients. We are recruiting a data analyst to build and strength the solutions of Global Procurement, covering aspects that goes from data insights, data visualization, digitalization, to process improvements, project management and more. This role will closely interact with procurement categories, from both direct and indirect realms, risk management team, and partners across departments.

Key Responsibilities


Own and manage databases to develop insights for Global Procurement and partners within the company.
Drive data visualization initiatives, having a customer centric mentality.
Identify and address areas of improvement for data quality.
Represent Global Procurement in forums around Master Data.
Co-lead digitalization and automation initiatives, with the objective to automate data gathering, data analytics, and reporting.
Support on identifying and implementing process improvements.
Collaborate with category managers and partners for data interpretation and gather feedback for continuous improvements.
Collaborate with other SME across teams in other to leverage to the maximum the power of data.
A minimum of 4 years of strong experience in procurement and/ or related supply chains required, with exposure to data analytics.
Proven analytical approach and ability to work with sophisticated data / information set is required.
Highly organized and structured mentality is required.
Experience with SAP, or another ERP, device management and digital procurement systems.
Experience on creating, developing and maintaining dashboards (e.g., Qlik, PowerBI, etc.)
Proven verbal and written communication skill with ability to confidently present sophisticated information (e.g., visual and verbal storytelling).
Experience to work across regions and understand markets.
Project management experience/certificate is preferred.
Experience in multiple fields of Supply Chain, including External Operations, Manufacturing, Procurement, Distribution and / or Quality related field is advantageous.
Continuous improvement/lean/six sigma experience, preferred.


For more than 130 years, diversity, equity & inclusion (DEI) has been a part of our cultural fabric at Johnson & Johnson and woven into how we do business every day. Rooted in Our Credo, the values of DEI fuel our pursuit to create a healthier, more equitable world. Our diverse workforce and culture of belonging accelerate innovation to solve the world's most pressing healthcare challenges.

We know that the success of our business - and our ability to deliver meaningful solutions - depends on how well we understand and meet the diverse needs of the communities we serve. Which is why we foster a culture of inclusion and belonging where all perspectives, abilities and experiences are valued and our people can reach their potential.

At Johnson & Johnson, we all belong.
Show more ","<div class=""description__text description__text--rich"">
        
    
    
    

    <section data-max-lines=""5"" class=""show-more-less-html"">
        <div class=""show-more-less-html__markup show-more-less-html__markup--clamp-after-5
            relative overflow-hidden"">
          Abiomed is recruiting for a Data Analyst - Data Analytics &amp; Governance, located in Danvers, MA or Aachen, Germany.<br><br>At Johnson &amp; Johnson, we believe health is everything. Our strength in healthcare innovation empowers us to build a world where complex diseases are prevented, treated, and cured, where treatments are smarter and less invasive, and solutions are personal. Through our expertise in Innovative Medicine and MedTech, we are uniquely positioned to innovate across the full spectrum of healthcare solutions today to deliver the breakthroughs of tomorrow, and profoundly impact health for humanity. Learn more at https://www.jnj.com/.<br><br>I Am Abiomed | I Am Heart Recovery | Patients First!<br><br>Data Analytics &amp; Governance is the team that empowers and enables the Global Procurement Organization via centralized and streamlined solutions for swift, data-driven decisions with the ambition to successfully support the Global Procurement vision and better serve our patients. We are recruiting a data analyst to build and strength the solutions of Global Procurement, covering aspects that goes from data insights, data visualization, digitalization, to process improvements, project management and more. This role will closely interact with procurement categories, from both direct and indirect realms, risk management team, and partners across departments.<br><br><strong>Key Responsibilities<br><br></strong><ul><li> Own and manage databases to develop insights for Global Procurement and partners within the company. </li><li> Drive data visualization initiatives, having a customer centric mentality. </li><li> Identify and address areas of improvement for data quality. </li><li> Represent Global Procurement in forums around Master Data. </li><li> Co-lead digitalization and automation initiatives, with the objective to automate data gathering, data analytics, and reporting. </li><li> Support on identifying and implementing process improvements. </li><li> Collaborate with category managers and partners for data interpretation and gather feedback for continuous improvements. </li><li> Collaborate with other SME across teams in other to leverage to the maximum the power of data. </li><li> A minimum of 4 years of strong experience in procurement and/ or related supply chains required, with exposure to data analytics. </li><li> Proven analytical approach and ability to work with sophisticated data / information set is required. </li><li> Highly organized and structured mentality is required. </li><li> Experience with SAP, or another ERP, device management and digital procurement systems. </li><li> Experience on creating, developing and maintaining dashboards (e.g., Qlik, PowerBI, etc.) </li><li> Proven verbal and written communication skill with ability to confidently present sophisticated information (e.g., visual and verbal storytelling). </li><li> Experience to work across regions and understand markets. </li><li> Project management experience/certificate is preferred. </li><li> Experience in multiple fields of Supply Chain, including External Operations, Manufacturing, Procurement, Distribution and / or Quality related field is advantageous. </li><li> Continuous improvement/lean/six sigma experience, preferred. <br><br></li></ul>For more than 130 years, diversity, equity &amp; inclusion (DEI) has been a part of our cultural fabric at Johnson &amp; Johnson and woven into how we do business every day. Rooted in Our Credo, the values of DEI fuel our pursuit to create a healthier, more equitable world. Our diverse workforce and culture of belonging accelerate innovation to solve the world's most pressing healthcare challenges.<br><br>We know that the success of our business - and our ability to deliver meaningful solutions - depends on how well we understand and meet the diverse needs of the communities we serve. Which is why we foster a culture of inclusion and belonging where all perspectives, abilities and experiences are valued and our people can reach their potential.<br><br>At Johnson &amp; Johnson, we all belong.
        </div>

        

    
    
    

    <button aria-expanded=""false"" aria-label=""i18n_show_more"" data-tracking-control-name=""public_jobs_show-more-html-btn"" class=""show-more-less-html__button show-more-less-button
        show-more-less-html__button--more
        ml-0.5"">
<!---->
        
            Show more
          

          <icon class=""show-more-less-html__button-icon show-more-less-button-icon lazy-loaded"" aria-hidden=""true"" aria-busy=""false""><svg xmlns=""http://www.w3.org/2000/svg"" width=""16"" height=""16"" preserveAspectRatio=""xMinYMin meet"" focusable=""false"" class=""lazy-loaded"" aria-busy=""false""><path d=""M8 9l5.93-4L15 6.54l-6.15 4.2a1.5 1.5 0 01-1.69 0L1 6.54 2.07 5z"" fill=""currentColor""></path></svg></icon>
    </button>
  

        

    
    
    

    <button aria-expanded=""true"" aria-label=""i18n_show_less"" data-tracking-control-name=""public_jobs_show-less-html-btn"" class=""show-more-less-html__button show-more-less-button
        show-more-less-html__button--less
        ml-0.5"">
<!---->
        
            Show less
          

          <icon class=""show-more-less-html__button-icon show-more-less-button-icon lazy-loaded"" aria-hidden=""true"" aria-busy=""false""><svg xmlns=""http://www.w3.org/2000/svg"" width=""16"" height=""16"" preserveAspectRatio=""xMinYMin meet"" focusable=""false"" class=""lazy-loaded"" aria-busy=""false""><path d=""M8 7l-5.9 4L1 9.5l6.2-4.2c.5-.3 1.2-.3 1.7 0L15 9.5 13.9 11 8 7z"" fill=""currentColor""></path></svg></icon>
    </button>
  
<!---->    </section>
  
      </div>",2024-11-09,[]
4069020406,https://www.linkedin.com/jobs/view/technical-data-analyst-at-dpr-construction-4069020406?position=38&pageNum=0&refId=c5Es4ELoYoc%2FGVJRD9HHmg%3D%3D&trackingId=3DWlhKeW8EwshjsxFqSbwQ%3D%3D,Technical Data Analyst,DPR Construction,"Boston, MA","Job Description

DPR Construction is seeking a Technical Data Analyst to work closely with cross-functional teams, including Data Engineering, Software Development, Business Intelligence Analysts, and other stakeholders to gather information, understand requirements, and build complex data models, datasets and custom views for downstream business use cases. This role will be responsible for collaborating with the Business intelligence Analysts, Data Engineering and the Technical Data Analytics Lead to develop and continuously improve the strategy around creation, maintenance, optimization and enhancement of the data pipeline and data analytics consumption.

Job Responsibilities Summary


Identify and integrate new datasets, creating complex data models and QA/QC workflows for data quality assurance.
Maintain and troubleshoot Power BI Dataflows, addressing data integrity and quality issues throughout the pipeline.
Conduct impact analysis on reporting changes, communicating implications and mitigation plans to stakeholders.
Develop and document dataflows, custom views, and contribute to a Data Dictionary and Self-Service platform.
Support data literacy and best practices, including developing a Self-Service framework for Citizen Data Analysts.
Drive continuous improvement via a technical roadmap for data models, tools, and processes.
Collaborate with stakeholders to deliver optimized data models, understanding and aligning with business requirements.
Use SQL to query the Data Warehouse for data analysis, dashboard creation, and identifying new data sources or integrations.
Identify root cause of data integrity issues (report, DFL, data warehouse, source system).
Follow, implement and enhance data security and governance guidelines.
Providing high quality data sets to data analysts
Understand the business questions that are being asked and predict the business questions that should be asked.
Document a dimensional model that can answer those questions.
Document needed source models to feed those dimensional models.
Transform source data into dimensional data using SQL and dbt.
Surface those dimensional models in Power BI
Add any additional measures in Power BI required for to prepare a data set ready for self-service.


Required Skills


Advanced SQL Skills:
Window functions, CTE, and Subqueries must be old hat. May have need to look up exact syntax but know exactly what to look up.
May have a developed personal code style, but willing to work with other style guides to make sure code is readable to the rest of the team.
Advanced Data Modeling Skills
Experience designing Star schemas.
Recognize the difference in Star Schemas and Snowflake.
Given an hour with the manager of an ice cream shop you could come out with a relational data model designed to run their business.
Familiarity with Kimball Design Concepts: bridge tables, role playing dimensions, grain, degenerate dimensions
Ability to recognize when an entity name is misleading and recommend solutions.
Power BI
Experience writing new measures in DAX
Recognize the difference between dataflows and data sets.
Understand the limitations of modeling in Power BI with regards to keys, relationships, and filter directionality.


Desired Skills


DBT
Understand how and why a model can be instantiated as a view, table, or kept ephemeral.
Strong opinion on writing tests for primary keys.
Understand how lineage is tracked
Understand how schemas work in dbt as compared with databases.
Git
Understand what a branch and a pull request is.
You might not be a git wizard, but you can get code from one branch to another.
You have an opinion about the proper path to production.


Education

Bachelor’s degree in computer science, information technology or a related discipline.

Work Conditions

Prolonged periods of sitting and/or standing at a computer screen.

Must be able to sit or stand for long periods of time.

Must be able to lift 15 pounds at times.

Additional Information

Occasional domestic travel, via airplane, will be required for meetings.

This is a hybrid role with most time being spent working from home. Attendance at important meetings and events at the local DPR office is required.

DPR has been nationally recognized for its strong company culture, based on a well-defined purpose “We Exist to Build Great Things,” and four core values: integrity, enjoyment, uniqueness and ever forward. A flat, title-less organization that empowers people at all levels to make decisions, DPR ranked on FORTUNE’s “100 Best Companies to Work For” list for five consecutive years. For more information, visit http://www.dpr.com.
Show more ","<div class=""description__text description__text--rich"">
        
    
    
    

    <section data-max-lines=""5"" class=""show-more-less-html"">
        <div class=""show-more-less-html__markup show-more-less-html__markup--clamp-after-5
            relative overflow-hidden"">
          <strong>Job Description<br><br></strong>DPR Construction is seeking a Technical Data Analyst to work closely with cross-functional teams, including Data Engineering, Software Development, Business Intelligence Analysts, and other stakeholders to gather information, understand requirements, and build complex data models, datasets and custom views for downstream business use cases. This role will be responsible for collaborating with the Business intelligence Analysts, Data Engineering and the Technical Data Analytics Lead to develop and continuously improve the strategy around creation, maintenance, optimization and enhancement of the data pipeline and data analytics consumption.<br><br><strong>Job Responsibilities Summary<br><br></strong><ul><li>Identify and integrate new datasets, creating complex data models and QA/QC workflows for data quality assurance.</li><li>Maintain and troubleshoot Power BI Dataflows, addressing data integrity and quality issues throughout the pipeline.</li><li>Conduct impact analysis on reporting changes, communicating implications and mitigation plans to stakeholders.</li><li>Develop and document dataflows, custom views, and contribute to a Data Dictionary and Self-Service platform.</li><li>Support data literacy and best practices, including developing a Self-Service framework for Citizen Data Analysts.</li><li>Drive continuous improvement via a technical roadmap for data models, tools, and processes.</li><li>Collaborate with stakeholders to deliver optimized data models, understanding and aligning with business requirements.</li><li>Use SQL to query the Data Warehouse for data analysis, dashboard creation, and identifying new data sources or integrations.</li><li>Identify root cause of data integrity issues (report, DFL, data warehouse, source system).</li><li>Follow, implement and enhance data security and governance guidelines.</li><li>Providing high quality data sets to data analysts</li><li>Understand the business questions that are being asked and predict the business questions that should be asked.</li><li>Document a dimensional model that can answer those questions.</li><li>Document needed source models to feed those dimensional models.</li><li>Transform source data into dimensional data using SQL and dbt.</li><li>Surface those dimensional models in Power BI</li><li>Add any additional measures in Power BI required for to prepare a data set ready for self-service.<br><br></li></ul><strong>Required Skills<br><br></strong><ul><li>Advanced SQL Skills:</li><li>Window functions, CTE, and Subqueries must be old hat. May have need to look up exact syntax but know exactly what to look up.</li><li>May have a developed personal code style, but willing to work with other style guides to make sure code is readable to the rest of the team.</li><li>Advanced Data Modeling Skills</li><li>Experience designing Star schemas.</li><li>Recognize the difference in Star Schemas and Snowflake.</li><li>Given an hour with the manager of an ice cream shop you could come out with a relational data model designed to run their business.</li><li>Familiarity with Kimball Design Concepts: bridge tables, role playing dimensions, grain, degenerate dimensions</li><li>Ability to recognize when an entity name is misleading and recommend solutions.</li><li>Power BI</li><li>Experience writing new measures in DAX</li><li>Recognize the difference between dataflows and data sets.</li><li>Understand the limitations of modeling in Power BI with regards to keys, relationships, and filter directionality.<br><br></li></ul><strong>Desired Skills<br><br></strong><ul><li>DBT</li><li>Understand how and why a model can be instantiated as a view, table, or kept ephemeral.</li><li>Strong opinion on writing tests for primary keys.</li><li>Understand how lineage is tracked</li><li>Understand how schemas work in dbt as compared with databases.</li><li>Git</li><li>Understand what a branch and a pull request is.</li><li>You might not be a git wizard, but you can get code from one branch to another.</li><li>You have an opinion about the proper path to production.<br><br></li></ul><strong>Education<br><br></strong>Bachelor’s degree in computer science, information technology or a related discipline.<br><br><strong>Work Conditions<br><br></strong>Prolonged periods of sitting and/or standing at a computer screen.<br><br>Must be able to sit or stand for long periods of time.<br><br>Must be able to lift 15 pounds at times.<br><br><strong>Additional Information<br><br></strong>Occasional domestic travel, via airplane, will be required for meetings.<br><br>This is a hybrid role with most time being spent working from home. Attendance at important meetings and events at the local DPR office is required.<br><br><em>DPR has been nationally recognized for its strong company culture, based on a well-defined purpose “We Exist to Build Great Things,” and four core values: integrity, enjoyment, uniqueness and ever forward. A flat, title-less organization that empowers people at all levels to make decisions, DPR ranked on FORTUNE’s “100 Best Companies to Work For” list for five consecutive years. For more information, visit http://www.dpr.com.</em>
        </div>

        

    
    
    

    <button aria-expanded=""false"" aria-label=""i18n_show_more"" data-tracking-control-name=""public_jobs_show-more-html-btn"" class=""show-more-less-html__button show-more-less-button
        show-more-less-html__button--more
        ml-0.5"">
<!---->
        
            Show more
          

          <icon class=""show-more-less-html__button-icon show-more-less-button-icon lazy-loaded"" aria-hidden=""true"" aria-busy=""false""><svg xmlns=""http://www.w3.org/2000/svg"" width=""16"" height=""16"" preserveAspectRatio=""xMinYMin meet"" focusable=""false"" class=""lazy-loaded"" aria-busy=""false""><path d=""M8 9l5.93-4L15 6.54l-6.15 4.2a1.5 1.5 0 01-1.69 0L1 6.54 2.07 5z"" fill=""currentColor""></path></svg></icon>
    </button>
  

        

    
    
    

    <button aria-expanded=""true"" aria-label=""i18n_show_less"" data-tracking-control-name=""public_jobs_show-less-html-btn"" class=""show-more-less-html__button show-more-less-button
        show-more-less-html__button--less
        ml-0.5"">
<!---->
        
            Show less
          

          <icon class=""show-more-less-html__button-icon show-more-less-button-icon lazy-loaded"" aria-hidden=""true"" aria-busy=""false""><svg xmlns=""http://www.w3.org/2000/svg"" width=""16"" height=""16"" preserveAspectRatio=""xMinYMin meet"" focusable=""false"" class=""lazy-loaded"" aria-busy=""false""><path d=""M8 7l-5.9 4L1 9.5l6.2-4.2c.5-.3 1.2-.3 1.7 0L15 9.5 13.9 11 8 7z"" fill=""currentColor""></path></svg></icon>
    </button>
  
<!---->    </section>
  
      </div>",2024-11-05,[]
