Job_ID,Link,Title,Company,Place,Description,HTML,Date,Skills
4103515445,https://es.linkedin.com/jobs/view/lead-data-scientist-at-adp-4103515445?position=59&pageNum=0&refId=h%2FfeODxnwsMgPYzmNiQwpw%3D%3D&trackingId=BEdvOlQYYCQAE%2BSnCfl2xQ%3D%3D,Lead Data Scientist,ADP,"Barcelona, Catalonia, Spain","ADP is hiring a Lead Data Scientist


Does the thought of working with one of the most comprehensive employment data sets excite you?
Are you empathetic to client needs and inspired by transformation and impacting the lives of millions of people every day?
Are you looking to join a dynamic, inclusive team environment with a culture of collaboration and belonging?


Well, this may be the role for you. Ready to design what's next?

In this role, you will work with teams to develop and apply machine learning to digitally transform our business processes and the client experience of ADP's products and solutions. You will collaborate with our machine learning engineers and software engineers in solving real-world business challenges using advanced machine learning techniques. You'll be accountable for something significant: products that impact people's lives.

No two days are the same. Everyday projects range from deep learning, research & development, algorithm development, natural language processing to deployment of ML models to productions.

To thrive in this career as a Lead Data Scientist for the OneAI team, you have the skills to design and implement Machine Learning systems using languages, frameworks, and tooling such as Python, AWS and Databricks in collaboration with the other team members. You should have experience building models in the areas such as natural language processing, deep learning, classification algorithms or recommender systems. You'll mentor other team members and help them grow. Our best people in this role are independent thinkers and proactive problem solvers, and as a lead team member, you will be a role model for these behaviors.

You'll need to have some formal education in Computer Science or a related quantitative field and know design patterns and data structures. You have the skills to leverage existing models or create new models using the technologies above. But given the scale of our data sets and the complex problems we give you to solve, you will stay challenged and engaged with years of exciting projects ahead—all while growing your skills and progressing in a rewarding career.

Like what you see? Apply now!

Learn More About ADP At Tech.adp.com/careers

A little about ADP: We are a global leader in HR technology, offering the latest AI and machine learning-enhanced payroll, tax, HR, benefits, and much more. We believe our people make all the difference in cultivating an inclusive, down-to-earth culture that welcomes ideas, encourages innovation, and values belonging. A global Best Places to Work, DiversityInc® Top 50 Company, Best CEO and company for women, LGBTQ+, multicultural talent, and more, ADP has a deep commitment to diversity, equity, and inclusion. Learn more about ADP's commitment on our YouTube channel: http://adp.careers/DEI_Videos

What You'll Do

Here's what you can expect on a typical day:


Collaborate and Build. You will collaborate with engineering and product teams in an Agile environment to identify, design, develop, and deploy advanced Machine Learning solutions.
Research & Development. You design and implement start-of-the-art data products, machine learning models, and systems to optimize the HCM system user experience. You are passionate about learning and applying new techniques within machine learning that leads to innovations.
Deliver at an epic scale. You write pristine code and documentation, champion and define best practices to produce highly adaptive, high-performing, continuous learning AI models/systems.
Teamwork and mentorship. You will be part of a thriving team, where you give other team members the space to balance the ability to think independently and creatively while also working together as a team. You'll provide mentorship to them get familiar with the team, environment, and resources. Once they are comfortable and confident, you will give them more challenges to take on.


To Succeed In This Role


Education. You have a bachelor’s degree (OR equivalent) in Computer Science, Engineering, Math, or a related field.
Experience. You have 6-8 years of experience in relevant skills gained and developed in the same or similar role.
Communication. You are an advanced English language speaker.
Technical skills. You have fluency in Python—including popular data science packages (pandas, sklearn, etc.), a strong knowledge of data structures, algorithms, and methods used for data science and machine learning, and familiarity with natural language processing.


Nice To Have (optional)


Master’s degree in computer science, engineering, math, or a related field
Knowledge of generative and embedding models
Experience with non-relational databases such as NoSQL and Vector databases
Exposure to Databricks platform, MLflow, and/or Jupyter notebooks
Understanding of data products (recommender systems, classifiers, chatbots, etc.)
Experience with AWS cloud solutions (S3, Glue, Lambda, Step, SageMaker) and CI/CD tools such as Jenkins.


You'll Love Working Here Because You Can


Team collaboration. Courage comes from how associates are willing to have difficult conversations, speak up, be an owner, and challenge one another's ideas to net out the best solution.
Deliver at epic scale. We deliver real user outcomes using strong judgment and good instincts. We're obsessed with the art of achieving simplicity with a focus on client happiness and productivity.
Be surrounded by curious learners. We align ourselves with other smart people in an environment where we grow and elevate one another to the next level. We encourage our associates to listen, stay agile, and learn from mistakes.
Act like an owner & doer. Mission-driven and committed to navigating change, you will be encouraged to take on any challenge and solve complex problems. No tasks are beneath or too great for us. We are hands-on and willing to master our craft.
Give back to others. Always do the right thing for our clients and our community and humbly give back to the community where we live and work. Support our associates in times of need through ADP's Philanthropic Foundation.
Join a company committed to equality and equity. Our goal is to impact lasting change through our actions.


What are you waiting for? Apply today!

Find out why people come to ADP and why they stay: https://youtu.be/ODb8lxBrxrY (ADA version: https://youtu.be/IQjUCA8SOoA )

Diversity, Equity, Inclusion & Equal Employment Opportunity at ADP: ADP is committed to an inclusive, diverse and equitable workplace, and is further committed to providing equal employment opportunities regardless of any protected characteristic including: race, color, genetic information, creed, national origin, religion, sex, affectional or sexual orientation, gender identity or expression, lawful alien status, ancestry, age, marital status, protected veteran status or disability. Hiring decisions are based upon ADP’s operating needs, and applicant merit including, but not limited to, qualifications, experience, ability, availability, cooperation, and job performance.

Ethics at ADP: ADP has a long, proud history of conducting business with the highest ethical standards and full compliance with all applicable laws. We also expect our people to uphold our values with the highest level of integrity and behave in a manner that fosters an honest and respectful workplace. Click https://jobs.adp.com/life-at-adp/ to learn more about ADP’s culture and our full set of values.
Show more ","<div class=""description__text description__text--rich"">
        
    
    
    

    <section data-max-lines=""5"" class=""show-more-less-html"">
        <div class=""show-more-less-html__markup show-more-less-html__markup--clamp-after-5
            relative overflow-hidden"">
          <strong>ADP is hiring a Lead Data Scientist<br><br></strong><ul><li>Does the thought of working with one of the most comprehensive employment data sets excite you?</li><li>Are you empathetic to client needs and inspired by transformation and impacting the lives of millions of people every day?</li><li>Are you looking to join a dynamic, inclusive team environment with a culture of collaboration and belonging? <br><br></li></ul>Well, this may be the role for you. Ready to design what's next?<br><br>In this role, you will work with teams to develop and apply machine learning to digitally transform our business processes and the client experience of ADP's products and solutions. You will collaborate with our machine learning engineers and software engineers in solving real-world business challenges using advanced machine learning techniques. You'll be accountable for something significant: products that impact people's lives.<br><br>No two days are the same. Everyday projects range from deep learning, research &amp; development, algorithm development, natural language processing to deployment of ML models to productions.<br><br>To thrive in this career as a Lead Data Scientist for the OneAI team, you have the skills to design and implement Machine Learning systems using languages, frameworks, and tooling such as Python, AWS and Databricks in collaboration with the other team members. You should have experience building models in the areas such as natural language processing, deep learning, classification algorithms or recommender systems. You'll mentor other team members and help them grow. Our best people in this role are independent thinkers and proactive problem solvers, and as a lead team member, you will be a role model for these behaviors.<br><br>You'll need to have some formal education in Computer Science or a related quantitative field and know design patterns and data structures. You have the skills to leverage existing models or create new models using the technologies above. But given the scale of our data sets and the complex problems we give you to solve, you will stay challenged and engaged with years of exciting projects ahead—all while growing your skills and progressing in a rewarding career.<br><br>Like what you see? <strong>Apply now!<br><br></strong><strong>Learn More About ADP At Tech.adp.com/careers<br><br></strong><strong>A little about ADP: </strong>We are a global leader in HR technology, offering the latest AI and machine learning-enhanced payroll, tax, HR, benefits, and much more. We believe our people make all the difference in cultivating an inclusive, down-to-earth culture that welcomes ideas, encourages innovation, and values belonging. A global Best Places to Work, DiversityInc® Top 50 Company, Best CEO and company for women, LGBTQ+, multicultural talent, and more, ADP has a deep commitment to diversity, equity, and inclusion. Learn more about ADP's commitment on our YouTube channel: http://adp.careers/DEI_Videos<br><br><strong>What You'll Do<br><br></strong><strong>Here's what you can expect on a typical day: <br><br></strong><ul><li>Collaborate and Build. You will collaborate with engineering and product teams in an Agile environment to identify, design, develop, and deploy advanced Machine Learning solutions. </li><li>Research &amp; Development. You design and implement start-of-the-art data products, machine learning models, and systems to optimize the HCM system user experience. You are passionate about learning and applying new techniques within machine learning that leads to innovations.</li><li>Deliver at an epic scale. You write pristine code and documentation, champion and define best practices to produce highly adaptive, high-performing, continuous learning AI models/systems.</li><li>Teamwork and mentorship. You will be part of a thriving team, where you give other team members the space to balance the ability to think independently and creatively while also working together as a team. You'll provide mentorship to them get familiar with the team, environment, and resources. Once they are comfortable and confident, you will give them more challenges to take on.<br><br></li></ul><strong>To Succeed In This Role<br><br></strong><ul><li>Education. You have a bachelor’s degree (OR equivalent) in Computer Science, Engineering, Math, or a related field.</li><li>Experience. You have 6-8 years of experience in relevant skills gained and developed in the same or similar role.</li><li>Communication. You are an advanced English language speaker.</li><li>Technical skills. You have fluency in Python—including popular data science packages (pandas, sklearn, etc.), a strong knowledge of data structures, algorithms, and methods used for data science and machine learning, and familiarity with natural language processing. <br><br></li></ul><strong>Nice To Have (optional)<br><br></strong><ul><li>Master’s degree in computer science, engineering, math, or a related field</li><li>Knowledge of generative and embedding models </li><li>Experience with non-relational databases such as NoSQL and Vector databases</li><li>Exposure to Databricks platform, MLflow, and/or Jupyter notebooks</li><li>Understanding of data products (recommender systems, classifiers, chatbots, etc.)</li><li>Experience with AWS cloud solutions (S3, Glue, Lambda, Step, SageMaker) and CI/CD tools such as Jenkins.<br><br></li></ul><strong>You'll Love Working Here Because You Can<br><br></strong><ul><li>Team collaboration. Courage comes from how associates are willing to have difficult conversations, speak up, be an owner, and challenge one another's ideas to net out the best solution.</li><li>Deliver at epic scale. We deliver real user outcomes using strong judgment and good instincts. We're obsessed with the art of achieving simplicity with a focus on client happiness and productivity.</li><li>Be surrounded by curious learners. We align ourselves with other smart people in an environment where we grow and elevate one another to the next level. We encourage our associates to listen, stay agile, and learn from mistakes.</li><li>Act like an owner &amp; doer. Mission-driven and committed to navigating change, you will be encouraged to take on any challenge and solve complex problems. No tasks are beneath or too great for us. We are hands-on and willing to master our craft.</li><li>Give back to others. Always do the right thing for our clients and our community and humbly give back to the community where we live and work. Support our associates in times of need through ADP's Philanthropic Foundation.</li><li>Join a company committed to equality and equity. Our goal is to impact lasting change through our actions.<br><br></li></ul>What are you waiting for? <strong>Apply today! <br><br></strong><strong>Find out why people come to ADP and why they stay:</strong> https://youtu.be/ODb8lxBrxrY (ADA version: https://youtu.be/IQjUCA8SOoA )<br><br><strong>Diversity, Equity, Inclusion &amp; Equal Employment Opportunity at ADP:</strong> ADP is committed to an inclusive, diverse and equitable workplace, and is further committed to providing equal employment opportunities regardless of any protected characteristic including: race, color, genetic information, creed, national origin, religion, sex, affectional or sexual orientation, gender identity or expression, lawful alien status, ancestry, age, marital status, protected veteran status or disability. Hiring decisions are based upon ADP’s operating needs, and applicant merit including, but not limited to, qualifications, experience, ability, availability, cooperation, and job performance.<br><br><strong>Ethics at ADP:</strong> ADP has a long, proud history of conducting business with the highest ethical standards and full compliance with all applicable laws. We also expect our people to uphold our values with the highest level of integrity and behave in a manner that fosters an honest and respectful workplace. Click https://jobs.adp.com/life-at-adp/ to learn more about ADP’s culture and our full set of values.
        </div>

        

    
    
    

    <button aria-expanded=""false"" aria-label=""i18n_show_more"" data-tracking-control-name=""public_jobs_show-more-html-btn"" class=""show-more-less-html__button show-more-less-button
        show-more-less-html__button--more
        ml-0.5"">
<!---->
        
            Show more
          

          <icon class=""show-more-less-html__button-icon show-more-less-button-icon lazy-loaded"" aria-hidden=""true"" aria-busy=""false""><svg xmlns=""http://www.w3.org/2000/svg"" width=""16"" height=""16"" preserveAspectRatio=""xMinYMin meet"" focusable=""false"" class=""lazy-loaded"" aria-busy=""false""><path d=""M8 9l5.93-4L15 6.54l-6.15 4.2a1.5 1.5 0 01-1.69 0L1 6.54 2.07 5z"" fill=""currentColor""></path></svg></icon>
    </button>
  

        

    
    
    

    <button aria-expanded=""true"" aria-label=""i18n_show_less"" data-tracking-control-name=""public_jobs_show-less-html-btn"" class=""show-more-less-html__button show-more-less-button
        show-more-less-html__button--less
        ml-0.5"">
<!---->
        
            Show less
          

          <icon class=""show-more-less-html__button-icon show-more-less-button-icon lazy-loaded"" aria-hidden=""true"" aria-busy=""false""><svg xmlns=""http://www.w3.org/2000/svg"" width=""16"" height=""16"" preserveAspectRatio=""xMinYMin meet"" focusable=""false"" class=""lazy-loaded"" aria-busy=""false""><path d=""M8 7l-5.9 4L1 9.5l6.2-4.2c.5-.3 1.2-.3 1.7 0L15 9.5 13.9 11 8 7z"" fill=""currentColor""></path></svg></icon>
    </button>
  
<!---->    </section>
  
      </div>",2024-12-17,[]
4102735049,https://es.linkedin.com/jobs/view/senior-data-scientist-at-festo-espa%C3%B1a-4102735049?position=60&pageNum=0&refId=h%2FfeODxnwsMgPYzmNiQwpw%3D%3D&trackingId=u3LLEu18bcAEUxHBXsUWEw%3D%3D,Senior Data Scientist,Festo España,Greater Barcelona Metropolitan Area,"About FESTO: FESTO is a leading global company in automation technology and technical education. We are committed to driving innovation and providing high-quality products and services to our customers. Our Digital Sales Hub in Barcelona is at the forefront of driving data-driven decisions to optimize our sales processes and strategies.




Job Summary: We are seeking an experienced and highly skilled Senior Data Scientist to join our Digital Sales Hub in Barcelona. The ideal candidate will have extensive experience in data modelling, a strong analytical mindset, and the ability to turn data into actionable insights.




Key Responsibilities:

Conceptualize, follow up, and deliver analytics projects, including definition of data sources, data pipelines and consistency of data models.
Design, customize and implement statistical and predictive models to optimize sales processes and strategies (XGboost, SVM, clustering, attribution models, statistical ranking models…)
Develop and present comprehensive data-driven insights and recommendations to senior management and stakeholders, ensuring that complex data insights are understood and actionable.
Mentor and guide junior data analysts and data scientists, fostering a culture of continuous learning and improvement.
Review and oversee tasks performed by juniors, ensuring accuracy and quality of work.




Qualifications:

Master’s degree in Data Science, Statistics, Mathematics, Computer Science, or a related field. A PhD is a plus.
5+ years of experience as a Data Scientist, preferably in a sales or business analytics role.
Strong analytical skills, attention to detail and technical leadership.
Proficiency in Python, advanced knowledge of SQL and experience with large-scale cloud data analysis frameworks and data governance.
Ability to find the simplest modelling solution according to the characteristics of each problem.
Ability to extract and translate business metrics and questions from data sets into well-documented and actionable insights.
Strong communication skills, with the ability to present complex data-driven insights clearly and effectively to both technical and non-technical audiences.
Fluent in English; proficiency in Spanish is a plus.




What We Offer:

Competitive salary and benefits package.
Opportunities for professional growth and development.
A collaborative and innovative work environment.
Show more ","<div class=""description__text description__text--rich"">
        
    
    
    

    <section data-max-lines=""5"" class=""show-more-less-html"">
        <div class=""show-more-less-html__markup show-more-less-html__markup--clamp-after-5
            relative overflow-hidden"">
          <p><strong>About FESTO:</strong> FESTO is a leading global company in automation technology and technical education. We are committed to driving innovation and providing high-quality products and services to our customers. Our Digital Sales Hub in Barcelona is at the forefront of driving data-driven decisions to optimize our sales processes and strategies.</p><p><br></p><p><strong>Job Summary:</strong> We are seeking an experienced and highly skilled Senior Data Scientist to join our Digital Sales Hub in Barcelona. The ideal candidate will have extensive experience in data modelling, a strong analytical mindset, and the ability to turn data into actionable insights. </p><p><br></p><p><strong>Key Responsibilities:</strong></p><ul><li>Conceptualize, follow up, and deliver analytics projects, including definition of data sources, data pipelines and consistency of data models.</li><li>Design, customize and implement statistical and predictive models to optimize sales processes and strategies (XGboost, SVM, clustering, attribution models, statistical ranking models…)</li><li>Develop and present comprehensive data-driven insights and recommendations to senior management and stakeholders, ensuring that complex data insights are understood and actionable.</li><li>Mentor and guide junior data analysts and data scientists, fostering a culture of continuous learning and improvement.</li><li>Review and oversee tasks performed by juniors, ensuring accuracy and quality of work. </li></ul><p><br></p><p><strong>Qualifications:</strong></p><ul><li>Master’s degree in Data Science, Statistics, Mathematics, Computer Science, or a related field. A PhD is a plus.</li><li>5+ years of experience as a Data Scientist, preferably in a sales or business analytics role.</li><li>Strong analytical skills, attention to detail and technical leadership.</li><li>Proficiency in Python, advanced knowledge of SQL and experience with large-scale cloud data analysis frameworks and data governance.</li><li>Ability to find the simplest modelling solution according to the characteristics of each problem.</li><li>Ability to extract and translate business metrics and questions from data sets into well-documented and actionable insights.</li><li>Strong communication skills, with the ability to present complex data-driven insights clearly and effectively to both technical and non-technical audiences.</li><li>Fluent in English; proficiency in Spanish is a plus.</li></ul><p><br></p><p><strong>What We Offer:</strong></p><ul><li>Competitive salary and benefits package.</li><li>Opportunities for professional growth and development.</li><li>A collaborative and innovative work environment.</li></ul>
        </div>

        

    
    
    

    <button aria-expanded=""false"" aria-label=""i18n_show_more"" data-tracking-control-name=""public_jobs_show-more-html-btn"" class=""show-more-less-html__button show-more-less-button
        show-more-less-html__button--more
        ml-0.5"">
<!---->
        
            Show more
          

          <icon class=""show-more-less-html__button-icon show-more-less-button-icon lazy-loaded"" aria-hidden=""true"" aria-busy=""false""><svg xmlns=""http://www.w3.org/2000/svg"" width=""16"" height=""16"" preserveAspectRatio=""xMinYMin meet"" focusable=""false"" class=""lazy-loaded"" aria-busy=""false""><path d=""M8 9l5.93-4L15 6.54l-6.15 4.2a1.5 1.5 0 01-1.69 0L1 6.54 2.07 5z"" fill=""currentColor""></path></svg></icon>
    </button>
  

        

    
    
    

    <button aria-expanded=""true"" aria-label=""i18n_show_less"" data-tracking-control-name=""public_jobs_show-less-html-btn"" class=""show-more-less-html__button show-more-less-button
        show-more-less-html__button--less
        ml-0.5"">
<!---->
        
            Show less
          

          <icon class=""show-more-less-html__button-icon show-more-less-button-icon lazy-loaded"" aria-hidden=""true"" aria-busy=""false""><svg xmlns=""http://www.w3.org/2000/svg"" width=""16"" height=""16"" preserveAspectRatio=""xMinYMin meet"" focusable=""false"" class=""lazy-loaded"" aria-busy=""false""><path d=""M8 7l-5.9 4L1 9.5l6.2-4.2c.5-.3 1.2-.3 1.7 0L15 9.5 13.9 11 8 7z"" fill=""currentColor""></path></svg></icon>
    </button>
  
<!---->    </section>
  
      </div>",2024-12-16,[]
