Job_ID,Link,Title,Company,Place,Description,HTML,Date,Skills
3959116887,https://se.linkedin.com/jobs/view/data-science-consultant-stockholm-at-management-solutions-3959116887?position=37&pageNum=0&refId=wP7PQDCy1dTsoCo1y%2FCNyg%3D%3D&trackingId=w2da7s6PLJKj9ucV70LDvA%3D%3D&trk=public_jobs_jserp-result_search-card,DATA SCIENCE CONSULTANT STOCKHOLM,Management Solutions,"Stockholm, Stockholm County, Sweden","Role:




Statistical data processing (Data Mining)
Artificial Intelligence (AI), including generative AI
Predictive modeling using Machine Learning and Data Science techniques
Time-series modeling (ARIMA and panel data models) and simulation models (Monte Carlo)
Development, validation and audit of financial, risk, marketing and business-oriented models
R&D projects




Requirements:




Recent graduates or final year students.
Should desirably have knowledge of Artificial Intelligence modeling techniques (logit, GLM, time series, random forests, clustering, XGBoost), statistical programming languages (SAS, R, Python, Matlab), big data tools and platforms (Hadoop, Hive, etc.) and cloud platforms (AWS, Azure, GCP).
Solid academic record.
Strong computer skills.
Postgraduate studies and/or specialized courses are an asset, especially in Data Science, Artificial Intelligence, Quantitative Finance or similar.
Knowledge of other languages is desirable.
Get-up-and-go attitude, maturity, responsibility and strong work ethic.
Strong ability to learn quickly.
Able to integrate easily into multidisciplinary teams.







What we offer:




We offer you the possibility to join a firm that provides all you need to develop your talent to the fullest:




Working in the highest-profile consulting projects in the industry,
for the largest companies, leaders of their respective markets,
alongside top industry management as they face challenges at the national and global level,
as part of an extraordinary team of professionals whose values and corporate culture are a benchmark for the industry




Training:

Ongoing training plan, with approximately 10% of business turnover spent on training.
Specialist knowledge courses, external expert courses, professional skills courses and language courses.
Last year our staff as a whole received over 330,000 hours of training spanning more than 750 courses.




Career plan:

Clearly defined career plan.
Internal promotion based solely on merit.
Partnership-based management model offers all professionals the opportunity to become part of the Firm’s group of partners




Complementary experiences:




University: we maintain a close relationship with the world’s most prestigious universities.
Social Action: we organize more than 30 community support activities.
Sports Club: internal and external tournaments.




How to apply:




If you are interested in our offer, please complete our application form online at https://www.managementsolutions.com/en/professional-careers-send-us-your-cv

Show more ","<div class=""description__text description__text--rich"">
        
    
    
    

    <section data-max-lines=""5"" class=""show-more-less-html"">
        <div class=""show-more-less-html__markup show-more-less-html__markup--clamp-after-5
            relative overflow-hidden"">
          <p><strong>Role:</strong></p><p><br></p><ul><li>Statistical data processing (Data Mining)</li><li>Artificial Intelligence (AI), including generative AI</li><li>Predictive modeling using Machine Learning and Data Science techniques</li><li>Time-series modeling (ARIMA and panel data models) and simulation models (Monte Carlo)</li><li>Development, validation and audit of financial, risk, marketing and business-oriented models</li><li>R&amp;D projects</li></ul><p><br></p><p><strong>Requirements:</strong></p><p><br></p><ul><li>Recent graduates or final year students.</li><li>Should desirably have knowledge of Artificial Intelligence modeling techniques (logit, GLM, time series, random forests, clustering, XGBoost), statistical programming languages (SAS, R, Python, Matlab), big data tools and platforms (Hadoop, Hive, etc.) and <strong><em>cloud platforms</em></strong> (AWS, Azure, GCP).</li><li>Solid academic record.</li><li>Strong computer skills.</li><li>Postgraduate studies and/or specialized courses are an asset, especially in Data Science, Artificial Intelligence, Quantitative Finance or similar.</li><li>Knowledge of other languages is desirable.</li><li>Get-up-and-go attitude, maturity, responsibility and strong work ethic.</li><li>Strong ability to learn quickly.</li><li>Able to integrate easily into multidisciplinary teams.</li></ul><p><br></p><p><br></p><p><strong>What we offer:</strong></p><p><br></p><p>We offer you the possibility to join a firm that provides all you need to develop your talent to the fullest:</p><p><br></p><ul><li>Working in the highest-profile consulting projects in the industry,</li><li>for the largest companies, leaders of their respective markets,</li><li>alongside top industry management as they face challenges at the national and global level,</li><li>as part of an extraordinary team of professionals whose values and corporate culture are a benchmark for the industry</li></ul><p><br></p><p><strong>Training:</strong></p><ul><li>Ongoing training plan, with approximately 10% of business turnover spent on training.</li><li>Specialist knowledge courses, external expert courses, professional skills courses and language courses.</li><li>Last year our staff as a whole received over 330,000 hours of training spanning more than 750 courses.</li></ul><p><br></p><p><strong>Career plan:</strong></p><ul><li>Clearly defined career plan.</li><li>Internal promotion based solely on merit.</li><li>Partnership-based management model offers all professionals the opportunity to become part of the Firm’s group of partners</li></ul><p><br></p><p><strong>Complementary experiences:</strong></p><p><br></p><ul><li>University: we maintain a close relationship with the world’s most prestigious universities.</li><li>Social Action: we organize more than 30 community support activities.</li><li>Sports Club: internal and external tournaments.</li></ul><p><br></p><p><strong>How to apply:</strong></p><p><br></p><ul><li>If you are interested in our offer, please complete our application form online at <u>https://www.managementsolutions.com/en/professional-careers-send-us-your-cv</u></li></ul><p></p>
        </div>

        

    
    
    

    <button aria-expanded=""false"" aria-label=""i18n_show_more"" data-tracking-control-name=""public_jobs_show-more-html-btn"" class=""show-more-less-html__button show-more-less-button
        show-more-less-html__button--more
        ml-0.5"">
<!---->
        
            Show more
          

          <icon class=""show-more-less-html__button-icon show-more-less-button-icon lazy-loaded"" aria-hidden=""true"" aria-busy=""false""><svg xmlns=""http://www.w3.org/2000/svg"" width=""16"" height=""16"" preserveAspectRatio=""xMinYMin meet"" focusable=""false"" class=""lazy-loaded"" aria-busy=""false""><path d=""M8 9l5.93-4L15 6.54l-6.15 4.2a1.5 1.5 0 01-1.69 0L1 6.54 2.07 5z"" fill=""currentColor""></path></svg></icon>
    </button>
  

        

    
    
    

    <button aria-expanded=""true"" aria-label=""i18n_show_less"" data-tracking-control-name=""public_jobs_show-less-html-btn"" class=""show-more-less-html__button show-more-less-button
        show-more-less-html__button--less
        ml-0.5"">
<!---->
        
            Show less
          

          <icon class=""show-more-less-html__button-icon show-more-less-button-icon lazy-loaded"" aria-hidden=""true"" aria-busy=""false""><svg xmlns=""http://www.w3.org/2000/svg"" width=""16"" height=""16"" preserveAspectRatio=""xMinYMin meet"" focusable=""false"" class=""lazy-loaded"" aria-busy=""false""><path d=""M8 7l-5.9 4L1 9.5l6.2-4.2c.5-.3 1.2-.3 1.7 0L15 9.5 13.9 11 8 7z"" fill=""currentColor""></path></svg></icon>
    </button>
  
<!---->    </section>
  
      </div>",2024-07-26,[]
3972034921,https://se.linkedin.com/jobs/view/senior-data-scientist-at-haypp-group-3972034921?position=42&pageNum=0&refId=wP7PQDCy1dTsoCo1y%2FCNyg%3D%3D&trackingId=kKrYgwt%2Bzla7Fzm7tVVD2w%3D%3D&trk=public_jobs_jserp-result_search-card,Senior Data Scientist,Haypp Group,"Stockholm, Stockholm County, Sweden","HAYPP GROUP

We address one of the world’s biggest problems – how to end smoking. There are 1,1 billion smokers in the world. Around 8 million people die every year from smoking-related diseases. Our goal is to significantly reduce death rates, save lives and inspire people to choose healthier enjoyment. How? By offering people safer nicotine online.

Haypp Group is one of the Nordics’ leading e-commerce groups with ten store brands, present in seven countries where we serve more than 1 million active consumers. Through brands such as Snusbolaget.se, Northerner.com, Nicokick.com etc., we sell nicotine pouches as well as Swedish style snus online. With our headquarters located on Östgötagatan in Stockholm we are 190 team members mainly but not exclusively based in Sweden. Also, we are an innovative and fast-moving company that is growing rapidly, driving sustainable business and are changing the world in the process. We are currently on an exciting expansion journey, converting more and more smokers to healthier alternatives across all our markets globally.

THE ROLE

We’re now looking for a Senior Data Scientist to join our data team in our tech department. Your initial focus will be on building A/B testing infrastructure and performance evaluation for our existing data science models. Further you’ll also lead the development, testing, and implementation of new data science and machine learning models. We’re working with the AWS technology stack, including Redshift, S3, EC2, Lambdas, SageMaker etc. with most data science models build in-house using Python & SQL.

As a Senior Data Scientist in Haypp, you’ll find modern technologies, agile workflows, and tight integration at the heart of the business. The ideal candidate will have a strong background in building A/B testing infrastructure and ensuring continuous performance evaluation of models in production. This role is critical in driving our data-driven initiatives and enhancing our product offerings. You will be working with the following things on a daily basis:


Model Development: Design, develop, and deploy advanced machine learning models to solve complex business problems.
A/B Testing Infrastructure: Build and maintain robust A/B testing frameworks to rigorously evaluate model performance and business impact.
Continuous Performance Evaluation: Implement continuous monitoring and evaluation systems for models in production to ensure they meet performance standards and business objectives.
Data Analysis: Perform extensive data analysis and statistical modeling to uncover insights and inform decision-making.
Collaboration: Work closely with cross-functional teams, including data engineers, product managers, and software developers, to integrate models into production systems.
Mentorship: Provide technical leadership and mentorship to data analysts, fostering a culture of learning and innovation.
Reporting: Communicate findings and insights to stakeholders through clear and compelling reports and presentations.


What We Want From You

For us, it is equally important to find the right fit on an interpersonal level between us and a new colleague as it is to find someone with the right experience and competence.

Successful candidates also meets the following requirements


Education: Master's or Ph.D. in Data Science, Computer Science, Statistics, Mathematics, or a related field.
Experience: Around 5 years of experience in data science and machine learning, with a proven track record of deploying models in production.
Technical Skills: Proficiency in Python, R, SQL, and relevant data science libraries (e.g., scikit-learn, PyTorch, LLMs and AI models).
Statistical Knowledge: Deep understanding of statistical analysis, experimental design, and A/B testing methodologies.
Analytical Thinking: Strong problem-solving skills and the ability to translate complex data into actionable insights.
Communication: Excellent written and verbal communication skills, with the ability to explain technical concepts to non-technical stakeholders.
Team Player: Ability to work effectively in a collaborative, fast-paced environment.


What We Offer

We are a value driven company with our values We team up, Innovation Drives Us, No Douchebags and Going the Extra Mile at the heartbeat of everything that we do. With us you can always expect to get help from people who want to achieve things together and to be able to speak your mind in every social constellation you are part of. We highly value all ideas no matter where they come from, and we are not afraid to try new things out. We are also welcoming, inclusive and everyone at Haypp Group has a voice. In addition, we seize opportunities by putting in hands-on, hard work and celebrating when we reach our goals. With us, you should always feel safe, appreciated and valued but at the same time challenged and excited.

Because we recognize that our team members are our most important differentiator, we offer our team members generous benefits. We offer the following perks to everyone at Haypp Group:


Premium ITP1 occupational pension savings plan
Insurance plan, including private healthcare
30 days of paid vacation
Parental pay lift
Wellness allowance of 5,000 SEK per year
Lots of social happenings


SEND US YOUR APPLICATION TODAY!

If this sounds like a place where you would want to contribute and grow, let us know you’re interested by submitting your application! Apply with your CV, a cover letter, through Linkedin or in any other way you feel represents you in the clearest possible way. All ways of connecting work for us!

Haypp Group is committed to equality and diversity, and we welcome applications from all qualified individuals regardless of ethnicity, religion, age, gender, sexual orientation, disability, and marital status. We want to offer you great recruitment experience, and if there is anything we can do to make you more comfortable in the process with us, please let us know.

If you have any questions about the role or what it’s like to work at Haypp Group in general, feel free to reach out to our responsible recruiter Viktoria Sobolewski at viktoria.sobolewski@hayppgroup.com. We look forward to hearing from you!

The Haypp Group is spearheading the global transformation from smoking to healthier product alternatives. With origins in Scandinavia our extensive experience from pioneering markets in smoke free alternatives, as well as being a leader in the e-commerce sector, we now fully bring our vision to a global scale.

With ten e-commerce brands, the Haypp Group is present in seven countries where we serve more than 790 000 consumers.
Show more ","<div class=""description__text description__text--rich"">
        
    
    
    

    <section data-max-lines=""5"" class=""show-more-less-html"">
        <div class=""show-more-less-html__markup show-more-less-html__markup--clamp-after-5
            relative overflow-hidden"">
          <strong>HAYPP GROUP<br><br></strong>We address one of the world’s biggest problems – how to end smoking. There are 1,1 billion smokers in the world. Around 8 million people die every year from smoking-related diseases. Our goal is to significantly reduce death rates, save lives and inspire people to choose healthier enjoyment. How? By offering people safer nicotine online.<br><br>Haypp Group is one of the Nordics’ leading e-commerce groups with ten store brands, present in seven countries where we serve more than 1 million active consumers. Through brands such as Snusbolaget.se, Northerner.com, Nicokick.com etc., we sell nicotine pouches as well as Swedish style snus online. With our headquarters located on Östgötagatan in Stockholm we are 190 team members mainly but not exclusively based in Sweden. Also, we are an innovative and fast-moving company that is growing rapidly, driving sustainable business and are changing the world in the process. We are currently on an exciting expansion journey, converting more and more smokers to healthier alternatives across all our markets globally.<br><br><strong>THE ROLE<br><br></strong>We’re now looking for a Senior Data Scientist to join our data team in our tech department. Your initial focus will be on building A/B testing infrastructure and performance evaluation for our existing data science models. Further you’ll also lead the development, testing, and implementation of new data science and machine learning models. We’re working with the AWS technology stack, including Redshift, S3, EC2, Lambdas, SageMaker etc. with most data science models build in-house using Python &amp; SQL.<br><br>As a Senior Data Scientist in Haypp, you’ll find modern technologies, agile workflows, and tight integration at the heart of the business. The ideal candidate will have a strong background in building A/B testing infrastructure and ensuring continuous performance evaluation of models in production. This role is critical in driving our data-driven initiatives and enhancing our product offerings. You will be working with the following things on a daily basis:<br><br><ul><li> Model Development: Design, develop, and deploy advanced machine learning models to solve complex business problems. </li><li> A/B Testing Infrastructure: Build and maintain robust A/B testing frameworks to rigorously evaluate model performance and business impact. </li><li> Continuous Performance Evaluation: Implement continuous monitoring and evaluation systems for models in production to ensure they meet performance standards and business objectives. </li><li> Data Analysis: Perform extensive data analysis and statistical modeling to uncover insights and inform decision-making. </li><li> Collaboration: Work closely with cross-functional teams, including data engineers, product managers, and software developers, to integrate models into production systems. </li><li> Mentorship: Provide technical leadership and mentorship to data analysts, fostering a culture of learning and innovation. </li><li> Reporting: Communicate findings and insights to stakeholders through clear and compelling reports and presentations. <br><br></li></ul><strong>What We Want From You<br><br></strong>For us, it is equally important to find the right fit on an interpersonal level between us and a new colleague as it is to find someone with the right experience and competence.<br><br>Successful candidates also meets the following requirements<br><br><ul><li> Education: Master's or Ph.D. in Data Science, Computer Science, Statistics, Mathematics, or a related field. </li><li> Experience: Around 5 years of experience in data science and machine learning, with a proven track record of deploying models in production. </li><li> Technical Skills: Proficiency in Python, R, SQL, and relevant data science libraries (e.g., scikit-learn, PyTorch, LLMs and AI models). </li><li> Statistical Knowledge: Deep understanding of statistical analysis, experimental design, and A/B testing methodologies. </li><li> Analytical Thinking: Strong problem-solving skills and the ability to translate complex data into actionable insights. </li><li> Communication: Excellent written and verbal communication skills, with the ability to explain technical concepts to non-technical stakeholders. </li><li> Team Player: Ability to work effectively in a collaborative, fast-paced environment. <br><br></li></ul><strong>What We Offer<br><br></strong>We are a value driven company with our values <em>We team up</em>, <em>Innovation Drives Us</em>, <em>No Douchebags</em> and <em>Going the Extra Mile</em> at the heartbeat of everything that we do. With us you can always expect to get help from people who want to achieve things together and to be able to speak your mind in every social constellation you are part of. We highly value all ideas no matter where they come from, and we are not afraid to try new things out. We are also welcoming, inclusive and everyone at Haypp Group has a voice. In addition, we seize opportunities by putting in hands-on, hard work and celebrating when we reach our goals. With us, you should always feel safe, appreciated and valued but at the same time challenged and excited.<br><br>Because we recognize that our team members are our most important differentiator, we offer our team members generous benefits. We offer the following perks to everyone at Haypp Group:<br><br><ul><li>Premium ITP1 occupational pension savings plan</li><li>Insurance plan, including private healthcare</li><li>30 days of paid vacation</li><li>Parental pay lift</li><li>Wellness allowance of 5,000 SEK per year</li><li>Lots of social happenings<br><br></li></ul><strong>SEND US YOUR APPLICATION TODAY!<br><br></strong>If this sounds like a place where you would want to contribute and grow, let us know you’re interested by submitting your application! Apply with your CV, a cover letter, through Linkedin or in any other way you feel represents you in the clearest possible way. All ways of connecting work for us!<br><br>Haypp Group is committed to equality and diversity, and we welcome applications from all qualified individuals regardless of ethnicity, religion, age, gender, sexual orientation, disability, and marital status. We want to offer you great recruitment experience, and if there is anything we can do to make you more comfortable in the process with us, please let us know.<br><br>If you have any questions about the role or what it’s like to work at Haypp Group in general, feel free to reach out to our responsible recruiter Viktoria Sobolewski at viktoria.sobolewski@hayppgroup.com. We look forward to hearing from you!<br><br>The Haypp Group is spearheading the global transformation from smoking to healthier product alternatives. With origins in Scandinavia our extensive experience from pioneering markets in smoke free alternatives, as well as being a leader in the e-commerce sector, we now fully bring our vision to a global scale.<br><br>With ten e-commerce brands, the Haypp Group is present in seven countries where we serve more than 790 000 consumers.
        </div>

        

    
    
    

    <button aria-expanded=""false"" aria-label=""i18n_show_more"" data-tracking-control-name=""public_jobs_show-more-html-btn"" class=""show-more-less-html__button show-more-less-button
        show-more-less-html__button--more
        ml-0.5"">
<!---->
        
            Show more
          

          <icon class=""show-more-less-html__button-icon show-more-less-button-icon lazy-loaded"" aria-hidden=""true"" aria-busy=""false""><svg xmlns=""http://www.w3.org/2000/svg"" width=""16"" height=""16"" preserveAspectRatio=""xMinYMin meet"" focusable=""false"" class=""lazy-loaded"" aria-busy=""false""><path d=""M8 9l5.93-4L15 6.54l-6.15 4.2a1.5 1.5 0 01-1.69 0L1 6.54 2.07 5z"" fill=""currentColor""></path></svg></icon>
    </button>
  

        

    
    
    

    <button aria-expanded=""true"" aria-label=""i18n_show_less"" data-tracking-control-name=""public_jobs_show-less-html-btn"" class=""show-more-less-html__button show-more-less-button
        show-more-less-html__button--less
        ml-0.5"">
<!---->
        
            Show less
          

          <icon class=""show-more-less-html__button-icon show-more-less-button-icon lazy-loaded"" aria-hidden=""true"" aria-busy=""false""><svg xmlns=""http://www.w3.org/2000/svg"" width=""16"" height=""16"" preserveAspectRatio=""xMinYMin meet"" focusable=""false"" class=""lazy-loaded"" aria-busy=""false""><path d=""M8 7l-5.9 4L1 9.5l6.2-4.2c.5-.3 1.2-.3 1.7 0L15 9.5 13.9 11 8 7z"" fill=""currentColor""></path></svg></icon>
    </button>
  
<!---->    </section>
  
      </div>",2024-08-01,[]
