Job_ID,Link,Title,Company,Place,Description,HTML,Date,Skills
4153223398,https://de.linkedin.com/jobs/view/data-scientist-logistics-choice-at-delivery-hero-4153223398?position=1&pageNum=0&refId=Lala0eQ83sU%2BblnlBlHutA%3D%3D&trackingId=mEWgjXMhwJ3J83yZmZvUDw%3D%3D,"Data Scientist - (Logistics, Choice)",Delivery Hero,"Berlin, Berlin, Germany","About The Opportunity

We are on the lookout for a Data Scientist - Customer Logistics, Choice to join the Logistics Team on our journey to always deliver amazing experiences.

In our Logistics Team, you’ll tackle high-impact challenges that make last-mile delivery efficient, affordable, and sustainable. Your work will directly improve experiences for riders, end customers, and merchants across the globe. Each enhancement you contribute will help Delivery Hero optimize delivery operations, supporting expansion into new areas like grocery and retail.

The Customer Logistics tribe’s mission is to build products that make it easy for local brands to run efficient operations and deliver a delightful order experience to customers so they order on repeat. The tribe comprises teams of skilled analysts, engineers, and scientists working together to deliver data solutions affecting every customer journey across all of Delivery Hero’s 70+ markets.


Drive the development and implementation of statistical, machine learning, and optimization models for choice optimization, rider fleet busyness and travel time prediction, and demand control. Collaborate with cross-functional teams to enhance the efficiency and performance of the machine learning models in across the vertical.
Analyse large-scale datasets to understand and identify opportunities by deploying sophisticated statistical techniques to improve decision-making in the domain.
Work on research initiatives to explore emerging trends and technologies in machine learning and data science, contributing to the advancement of Delivery Hero's digital products and algorithms. Stay informed about industry developments and incorporate new methodologies and best practices into our data science workflows.


What you need to be successful


You excel at modelling business problems using machine learning techniques covering feature engineering, model selection and design as well as evaluation and optimisation to deliver value to the business.
You have expertise in building and training advanced machine learning models with strong knowledge of the Python data toolkit ideally centring around Pandas, SQL, Sklearn, and PySpark.
Through the fluent use of SQL queries, you are able to explore our data universe and gather data to support your analysis and the development of machine-learning solutions.
You write clean, production-level code and effectively use software versioning with Git.
You are familiar with deploying and developing in cloud systems, ideally with experience in GCP and bigquery.
You love to learn and are a critical thinker and creative problem solver who strives for excellence; you are a team player who loves to collaborate and work with stakeholders from different tech teams in a diverse environment.


Nice to have:


Proven experience in addressing large-scale optimization problems (linear or mixed integer programming) is a strong asset.
Hands-on experience in creating causal models and deploying them in production is a plus.
Experience in designing and analysing advanced products/models experiments (switchback tests, quasi-experiments, non-standard A/B tests etc) is a plus.
Experience in working on logistics product development would be a great benefit.


Who we are

As the world’s pioneering local delivery platform, our mission is to deliver an amazing experience, fast, easy, and to your door. We operate in over 70+ countries worldwide, powered by tech, designed by people. As one of Europe’s largest tech platforms, headquartered in Berlin, Germany. Delivery Hero has been listed on the Frankfurt Stock Exchange since 2017 and is part of the MDAX stock market index. We enable creative minds to deliver solutions that create impact within our ecosystem. We move fast, take action and adapt. No matter where you're from or what you believe in, we build, we deliver, we lead. We are Delivery Hero.

What's in it for you

Ensuring you and all our Heroes are looked after, happy, and healthy is always on the menu. Because if you’re in good shape, then we’re in good shape.


Make the most of our hybrid working model and join the team for face-to-face connection and collaboration in our beautiful Berlin campus 2 days a week
We offer 27 days holiday with an extra day on 2nd and 3rd year of service
We will support you in developing yourself and your career growth opportunities: 1.000 € Educational Budget, Language Courses, Parental Support and access to the Udemy Business platform to explore a variety of online courses.
Get moving and release those wonderful, mind-boosting endorphins: Health Checkups, Meditation, Yoga, Gym & Bicycle Subsidy
Cash. Dough. Cheddar. Whatever you call it, we’ll help you with it: Employee Share Purchase Plan, Sabbatical Bank, Public Transportation Ticket Discount, Life & Accident Insurance, Corporate Pension Plan
The power of getting together over some food is unrivaled. Here are a few ways to help you do that. All the yum: Digital Meal Vouchers, Food Vouchers, Corporate Discounts. Courses.




Ready to join our team? If you’re excited to grow, collaborate and be part of the world’s leading delivery platform, we’d love to hear from you. Apply today!

We believe diversity and inclusion are key to creating not only an exciting product, but also an amazing customer and employee experience. Fostering this starts with hiring - therefore we do not discriminate on the basis of racial identities, religious beliefs, color, national origin, gender identities or expressions, sexual orientations, age, marital or disability statuses, or any other aspect that makes you, you. We encourage you to let us know if you need any accommodations or specific accessibility support to ensure a smooth interview experience—just include it in your application. You're welcome to share your pronouns (he/she/they) right from the start so we can address you respectfully from our first contact.
Show more ","<div class=""description__text description__text--rich"">
        
    
    
    

    <section data-max-lines=""5"" class=""show-more-less-html"">
        <div class=""show-more-less-html__markup show-more-less-html__markup--clamp-after-5
            relative overflow-hidden"">
          <strong>About The Opportunity<br><br></strong>We are on the lookout for a <strong>Data Scientist - Customer Logistics, Choice</strong> to join the Logistics Team on our journey to always deliver amazing experiences.<br><br>In our Logistics Team, you’ll tackle high-impact challenges that make last-mile delivery efficient, affordable, and sustainable. Your work will directly improve experiences for riders, end customers, and merchants across the globe. Each enhancement you contribute will help Delivery Hero optimize delivery operations, supporting expansion into new areas like grocery and retail.<br><br>The Customer Logistics tribe’s mission is to build products that make it easy for local brands to run efficient operations and deliver a delightful order experience to customers so they order on repeat. The tribe comprises teams of skilled analysts, engineers, and scientists working together to deliver data solutions affecting every customer journey across all of Delivery Hero’s 70+ markets.<br><br><ul><li>Drive the development and implementation of statistical, machine learning, and optimization models for choice optimization, rider fleet busyness and travel time prediction, and demand control. Collaborate with cross-functional teams to enhance the efficiency and performance of the machine learning models in across the vertical.</li><li>Analyse large-scale datasets to understand and identify opportunities by deploying sophisticated statistical techniques to improve decision-making in the domain.</li><li>Work on research initiatives to explore emerging trends and technologies in machine learning and data science, contributing to the advancement of Delivery Hero's digital products and algorithms. Stay informed about industry developments and incorporate new methodologies and best practices into our data science workflows.<br><br></li></ul><strong>What you need to be successful<br><br></strong><ul><li>You excel at modelling business problems using machine learning techniques covering feature engineering, model selection and design as well as evaluation and optimisation to deliver value to the business. </li><li>You have expertise in building and training advanced machine learning models with strong knowledge of the Python data toolkit ideally centring around Pandas, SQL, Sklearn, and PySpark. </li><li>Through the fluent use of SQL queries, you are able to explore our data universe and gather data to support your analysis and the development of machine-learning solutions.</li><li>You write clean, production-level code and effectively use software versioning with Git.</li><li>You are familiar with deploying and developing in cloud systems, ideally with experience in GCP and bigquery.</li><li>You love to learn and are a critical thinker and creative problem solver who strives for excellence; you are a team player who loves to collaborate and work with stakeholders from different tech teams in a diverse environment.<br><br></li></ul><strong>Nice to have:<br><br></strong><ul><li>Proven experience in addressing large-scale optimization problems (linear or mixed integer programming) is a strong asset.</li><li>Hands-on experience in creating causal models and deploying them in production is a plus.</li><li>Experience in designing and analysing advanced products/models experiments (switchback tests, quasi-experiments, non-standard A/B tests etc) is a plus.</li><li>Experience in working on logistics product development would be a great benefit.<br><br></li></ul><strong>Who we are<br><br></strong>As the world’s pioneering local delivery platform, our mission is to deliver an amazing experience, fast, easy, and to your door. We operate in over 70+ countries worldwide, powered by tech, designed by people. As one of Europe’s largest tech platforms, headquartered in Berlin, Germany. Delivery Hero has been listed on the Frankfurt Stock Exchange since 2017 and is part of the MDAX stock market index. We enable creative minds to deliver solutions that create impact within our ecosystem. We move fast, take action and adapt. No matter where you're from or what you believe in, we build, we deliver, we lead. We are Delivery Hero.<br><br><strong>What's in it for you<br><br></strong>Ensuring you and all our Heroes are looked after, happy, and healthy is always on the menu. Because if you’re in good shape, then we’re in good shape.<br><br><ul><li>Make the most of our hybrid working model and join the team for face-to-face connection and collaboration in our beautiful Berlin campus 2 days a week</li><li>We offer 27 days holiday with an extra day on 2nd and 3rd year of service</li><li>We will support you in developing yourself and your career growth opportunities: 1.000 € Educational Budget, Language Courses, Parental Support and access to the Udemy Business platform to explore a variety of online courses.</li><li>Get moving and release those wonderful, mind-boosting endorphins: Health Checkups, Meditation, Yoga, Gym &amp; Bicycle Subsidy</li><li>Cash. Dough. Cheddar. Whatever you call it, we’ll help you with it: Employee Share Purchase Plan, Sabbatical Bank, Public Transportation Ticket Discount, Life &amp; Accident Insurance, Corporate Pension Plan</li><li>The power of getting together over some food is unrivaled. Here are a few ways to help you do that. All the yum: Digital Meal Vouchers, Food Vouchers, Corporate Discounts. Courses.<br><br></li></ul><strong> <br><br></strong><strong><strong>Ready to join our team?</strong></strong> If you’re excited to grow, collaborate and be part of the world’s leading delivery platform, we’d love to hear from you. Apply today!<br><br>We believe diversity and inclusion are key to creating not only an exciting product, but also an amazing customer and employee experience. Fostering this starts with hiring - therefore we do not discriminate on the basis of racial identities, religious beliefs, color, national origin, gender identities or expressions, sexual orientations, age, marital or disability statuses, or any other aspect that makes you, you. We encourage you to let us know if you need any accommodations or specific accessibility support to ensure a smooth interview experience—just include it in your application. You're welcome to share your pronouns (he/she/they) right from the start so we can address you respectfully from our first contact.
        </div>

        

    
    
    

    <button aria-expanded=""false"" aria-label=""i18n_show_more"" data-tracking-control-name=""public_jobs_show-more-html-btn"" class=""show-more-less-html__button show-more-less-button
        show-more-less-html__button--more
        ml-0.5"">
<!---->
        
            Show more
          

          <icon class=""show-more-less-html__button-icon show-more-less-button-icon lazy-loaded"" aria-hidden=""true"" aria-busy=""false""><svg xmlns=""http://www.w3.org/2000/svg"" width=""16"" height=""16"" preserveAspectRatio=""xMinYMin meet"" focusable=""false"" class=""lazy-loaded"" aria-busy=""false""><path d=""M8 9l5.93-4L15 6.54l-6.15 4.2a1.5 1.5 0 01-1.69 0L1 6.54 2.07 5z"" fill=""currentColor""></path></svg></icon>
    </button>
  

        

    
    
    

    <button aria-expanded=""true"" aria-label=""i18n_show_less"" data-tracking-control-name=""public_jobs_show-less-html-btn"" class=""show-more-less-html__button show-more-less-button
        show-more-less-html__button--less
        ml-0.5"">
<!---->
        
            Show less
          

          <icon class=""show-more-less-html__button-icon show-more-less-button-icon lazy-loaded"" aria-hidden=""true"" aria-busy=""false""><svg xmlns=""http://www.w3.org/2000/svg"" width=""16"" height=""16"" preserveAspectRatio=""xMinYMin meet"" focusable=""false"" class=""lazy-loaded"" aria-busy=""false""><path d=""M8 7l-5.9 4L1 9.5l6.2-4.2c.5-.3 1.2-.3 1.7 0L15 9.5 13.9 11 8 7z"" fill=""currentColor""></path></svg></icon>
    </button>
  
<!---->    </section>
  
      </div>",2025-02-17,[]
