Job_ID,Link,Title,Company,Place,Description,HTML,Date,Skills
4069833208,https://www.linkedin.com/jobs/view/data-review-annotation-specialist-at-hayden-ai-4069833208?position=23&pageNum=0&refId=k%2FyoKfZfLPIIe2o9R5IfcQ%3D%3D&trackingId=8sjOOp%2BaFnclu1xmbHvufw%3D%3D,Data Review/Annotation Specialist,Hayden AI,"San Francisco, CA","About Us

At Hayden AI, we are on a mission to harness the power of artificial intelligence and machine learning to transform the way governments and businesses address real-world challenges.

From optimizing bus lane and bus stop enforcement to pioneering digital twin modeling and beyond, our innovative mobile perception system empowers our clients to accelerate transit, enhance street safety, and drive forward a sustainable future.

What the job involves:

Hayden AI is looking for a meticulous and detail-oriented Data Review/Annotation Coordinator to join our team. As a Data Review/Annotation Coordinator, you will be responsible for overseeing the quality assurance and annotation process of datasets, ensuring accuracy and consistency. You will work closely with our internal teams to maintain high standards of data integrity and facilitate the smooth execution of data-related projects. The ideal candidate has a strong analytical mindset, excellent communication skills, and a keen eye for identifying patterns and anomalies in the data pipeline.

Responsibilities:


Coordinate and manage the data review and annotation process, ensuring adherence to quality standards and project requirements.
Review and evaluate data sets for accuracy, completeness, and consistency, identifying and resolving discrepancies or errors.
Collaborate with different teams to understand project objectives and requirements for data review and annotation.
Develop and implement guidelines, protocols, and standard operating procedures for data review and annotation activities.
Assist with training data reviewers/annotators, providing guidance, feedback, and support to ensure consistent and accurate results.
Monitor and track progress of data review and annotation tasks, ensuring timelines are met and project goals are achieved.
Conduct regular quality control checks on reviewed/annotated data, implementing corrective measures as needed.
Collaborate with cross-functional teams to address data-related issues, provide insights, and contribute to process improvements.
Assist in data analysis and reporting tasks as needed, providing insights and recommendations based on the reviewed/annotated data.


Requirements:


Excellent attention to detail, with a high degree of accuracy in reviewing and annotating data.
Strong communication and interpersonal skills, with the ability to work collaboratively in a team environment.
Training experience
Ability to prioritize tasks, meet deadlines, and adapt to changing project requirements.
Strong problem-solving skills and the ability to provide actionable insights based on data analysis.
Knowledge of machine learning concepts and experience with data labeling for machine learning models is a plus.
Proficiency in using data analysis tools and software (such as Excel, SQL, or data annotation platforms) is a plus.
Familiarity with any programming language is a plus.


Benefits And Perks

There are endless learning and development opportunities from a highly diverse and talented peer group, including experts in a wide range of fields (AI, Computer Vision, Government Contracting, Systems & Device Engineering, Operations, Communications, and more!)


Options for medical, dental, and vision coverage for employees and dependents (for US employees)
Flexible Spending Account (FSA) and Dependent Care Flexible Spending Account (DCFSA)
401(k) with 3% company matching
Unlimited PTO
Daily catered lunches in our San Francisco office


At Hayden AI, we are committed to creating an inclusive and diverse workplace where everyone is treated with respect and dignity. We believe that our differences make us stronger and drive innovation. As an equal opportunity employer, we do not discriminate against any employee or applicant based on race, color, religion, sex, sexual orientation, gender identity, national origin, age, disability, veteran status, or any other legally protected status. We are dedicated to fostering a work environment that celebrates diversity and ensures that every individual has the opportunity to contribute to our mission and achieve their full potential.

Please do not forward resumes to our jobs alias, Hayden AI employees or any other company location. Hayden AI is not responsible for any fees related to unsolicited resumes.

Compensation Range: $79K - $92.9K
Show more ","<div class=""description__text description__text--rich"">
        
    
    
    

    <section data-max-lines=""5"" class=""show-more-less-html"">
        <div class=""show-more-less-html__markup show-more-less-html__markup--clamp-after-5
            relative overflow-hidden"">
          <strong>About Us<br><br></strong>At Hayden AI, we are on a mission to harness the power of artificial intelligence and machine learning to transform the way governments and businesses address real-world challenges.<br><br>From optimizing bus lane and bus stop enforcement to pioneering digital twin modeling and beyond, our innovative mobile perception system empowers our clients to accelerate transit, enhance street safety, and drive forward a sustainable future.<br><br>What the job involves:<br><br>Hayden AI is looking for a meticulous and detail-oriented Data Review/Annotation Coordinator to join our team. As a Data Review/Annotation Coordinator, you will be responsible for overseeing the quality assurance and annotation process of datasets, ensuring accuracy and consistency. You will work closely with our internal teams to maintain high standards of data integrity and facilitate the smooth execution of data-related projects. The ideal candidate has a strong analytical mindset, excellent communication skills, and a keen eye for identifying patterns and anomalies in the data pipeline.<br><br><strong>Responsibilities:<br><br></strong><ul><li>Coordinate and manage the data review and annotation process, ensuring adherence to quality standards and project requirements. </li><li>Review and evaluate data sets for accuracy, completeness, and consistency, identifying and resolving discrepancies or errors. </li><li>Collaborate with different teams to understand project objectives and requirements for data review and annotation. </li><li>Develop and implement guidelines, protocols, and standard operating procedures for data review and annotation activities. </li><li>Assist with training data reviewers/annotators, providing guidance, feedback, and support to ensure consistent and accurate results. </li><li>Monitor and track progress of data review and annotation tasks, ensuring timelines are met and project goals are achieved. </li><li>Conduct regular quality control checks on reviewed/annotated data, implementing corrective measures as needed. </li><li>Collaborate with cross-functional teams to address data-related issues, provide insights, and contribute to process improvements. </li><li>Assist in data analysis and reporting tasks as needed, providing insights and recommendations based on the reviewed/annotated data. <br><br></li></ul><strong>Requirements:<br><br></strong><ul><li>Excellent attention to detail, with a high degree of accuracy in reviewing and annotating data. </li><li>Strong communication and interpersonal skills, with the ability to work collaboratively in a team environment. </li><li>Training experience</li><li>Ability to prioritize tasks, meet deadlines, and adapt to changing project requirements. </li><li>Strong problem-solving skills and the ability to provide actionable insights based on data analysis. </li><li>Knowledge of machine learning concepts and experience with data labeling for machine learning models is a plus. </li><li>Proficiency in using data analysis tools and software (such as Excel, SQL, or data annotation platforms) is a plus. </li><li>Familiarity with any programming language is a plus. <br><br></li></ul><strong>Benefits And Perks<br><br></strong>There are endless learning and development opportunities from a highly diverse and talented peer group, including experts in a wide range of fields (AI, Computer Vision, Government Contracting, Systems &amp; Device Engineering, Operations, Communications, and more!)<br><br><ul><li>Options for medical, dental, and vision coverage for employees and dependents (for US employees)</li><li>Flexible Spending Account (FSA) and Dependent Care Flexible Spending Account (DCFSA)</li><li>401(k) with 3% company matching</li><li>Unlimited PTO</li><li>Daily catered lunches in our San Francisco office<br><br></li></ul>At Hayden AI, we are committed to creating an inclusive and diverse workplace where everyone is treated with respect and dignity. We believe that our differences make us stronger and drive innovation. As an equal opportunity employer, we do not discriminate against any employee or applicant based on race, color, religion, sex, sexual orientation, gender identity, national origin, age, disability, veteran status, or any other legally protected status. We are dedicated to fostering a work environment that celebrates diversity and ensures that every individual has the opportunity to contribute to our mission and achieve their full potential.<br><br>Please do not forward resumes to our jobs alias, Hayden AI employees or any other company location. Hayden AI is not responsible for any fees related to unsolicited resumes.<br><br>Compensation Range: $79K - $92.9K
        </div>

        

    
    
    

    <button aria-expanded=""false"" aria-label=""i18n_show_more"" data-tracking-control-name=""public_jobs_show-more-html-btn"" class=""show-more-less-html__button show-more-less-button
        show-more-less-html__button--more
        ml-0.5"">
<!---->
        
            Show more
          

          <icon class=""show-more-less-html__button-icon show-more-less-button-icon lazy-loaded"" aria-hidden=""true"" aria-busy=""false""><svg xmlns=""http://www.w3.org/2000/svg"" width=""16"" height=""16"" preserveAspectRatio=""xMinYMin meet"" focusable=""false"" class=""lazy-loaded"" aria-busy=""false""><path d=""M8 9l5.93-4L15 6.54l-6.15 4.2a1.5 1.5 0 01-1.69 0L1 6.54 2.07 5z"" fill=""currentColor""></path></svg></icon>
    </button>
  

        

    
    
    

    <button aria-expanded=""true"" aria-label=""i18n_show_less"" data-tracking-control-name=""public_jobs_show-less-html-btn"" class=""show-more-less-html__button show-more-less-button
        show-more-less-html__button--less
        ml-0.5"">
<!---->
        
            Show less
          

          <icon class=""show-more-less-html__button-icon show-more-less-button-icon lazy-loaded"" aria-hidden=""true"" aria-busy=""false""><svg xmlns=""http://www.w3.org/2000/svg"" width=""16"" height=""16"" preserveAspectRatio=""xMinYMin meet"" focusable=""false"" class=""lazy-loaded"" aria-busy=""false""><path d=""M8 7l-5.9 4L1 9.5l6.2-4.2c.5-.3 1.2-.3 1.7 0L15 9.5 13.9 11 8 7z"" fill=""currentColor""></path></svg></icon>
    </button>
  
<!---->    </section>
  
      </div>",2024-11-05,[]
4070493428,https://www.linkedin.com/jobs/view/fraud-data-analyst-the-fraud-detector-at-unreal-staffing-4070493428?position=26&pageNum=0&refId=k%2FyoKfZfLPIIe2o9R5IfcQ%3D%3D&trackingId=CBDLkhjL0gU5W7hXMpHuXQ%3D%3D,Fraud Data Analyst (The Fraud Detector),Unreal Staffing,"San Francisco, CA","Are you passionate about identifying fraudulent activity and protecting businesses from financial losses? Do you excel at analyzing patterns, developing insights, and creating proactive solutions to prevent fraud? If you're ready to leverage your analytical skills to safeguard our systems, our client has the ideal role for you. We're looking for a Fraud Data Analyst (aka The Fraud Detector) to analyze transaction data, detect potential fraud, and enhance risk mitigation strategies across the organization.

As a Fraud Data Analyst at our client, you'll work with fraud prevention teams, data scientists, and risk management to develop models, identify patterns, and implement fraud detection strategies. Your role will be critical in ensuring that potential fraud is detected early and that our client's financial assets and reputation remain protected.

Key Responsibilities:


Analyze Transaction Data for Fraud Detection:
Perform in-depth analyses of transaction data to identify patterns indicative of fraud. You'll use statistical methods to spot anomalies and flag suspicious activities for further investigation
Develop and Maintain Fraud Detection Models:
Build predictive models to detect fraudulent behavior in real-time using machine learning and data analytics tools. You'll implement algorithms that help automate fraud detection
Collaborate on Risk Assessment and Prevention Strategies:
Work closely with risk management teams to design fraud prevention strategies. You'll provide insights on vulnerabilities and recommend solutions to strengthen fraud defenses
Conduct Root Cause Analysis on Fraud Incidents:
Investigate fraudulent activities to understand their origins and impacts. You'll perform root cause analysis to identify gaps in current controls and suggest improvements
Create and Maintain Fraud Detection Dashboards:
Design and maintain dashboards using tools like Tableau or Power BI to provide real-time monitoring of fraud metrics. You'll ensure that stakeholders have access to actionable insights
Implement Data-Driven Rules and Alerts:
Establish data-driven rules and thresholds for flagging suspicious activities. You'll create automated alerts that enable faster responses to potential fraud cases
Stay Updated on Fraud Trends and Techniques:
Keep abreast of the latest trends in fraud schemes, methodologies, and detection technologies. You'll bring innovative strategies to improve fraud prevention and detection



Requirements

Required Skills:


Fraud Analysis and Pattern Recognition: Strong ability to detect patterns, anomalies, and indicators of fraud in data. Familiarity with transaction data analysis and fraud detection techniques
Predictive Modeling and Machine Learning: Experience building models for fraud detection using supervised and unsupervised learning techniques. Familiarity with tools like Python, R, or SQL for model development
Risk Assessment and Prevention: Understanding of risk management principles and strategies for fraud prevention. Ability to recommend preventive actions based on data insights
Data Visualization and Reporting: Proficiency in data visualization tools like Tableau, Power BI, or Looker for creating dashboards and presenting fraud data to stakeholders
Collaboration and Communication: Excellent communication skills for working with cross-functional teams and explaining complex fraud patterns to non-technical audiences



Educational Requirements:


Bachelor's or Master's degree in Data Science, Statistics, Business Analytics, Finance, or a related field. Equivalent experience in fraud analytics or risk management may be considered
Certifications in fraud examination or analytics (e.g., Certified Fraud Examiner (CFE), Certified Analytics Professional) are advantageous



Experience Requirements:


3+ years of experience in fraud analysis, risk management, or data analytics, with a proven track record of detecting and preventing fraudulent activities
Familiarity with financial services, e-commerce, or insurance fraud detection is highly beneficial
Experience with real-time data processing and anomaly detection is a plus



Benefits


Health and Wellness: Comprehensive medical, dental, and vision insurance plans with low co-pays and premiums
Paid Time Off: Competitive vacation, sick leave, and 20 paid holidays per year
Work-Life Balance: Flexible work schedules and telecommuting options
Professional Development: Opportunities for training, certification reimbursement, and career advancement programs
Wellness Programs: Access to wellness programs, including gym memberships, health screenings, and mental health resources
Life and Disability Insurance: Life insurance and short-term/long-term disability coverage
Employee Assistance Program (EAP): Confidential counseling and support services for personal and professional challenges
Tuition Reimbursement: Financial assistance for continuing education and professional development
Community Engagement: Opportunities to participate in community service and volunteer activities
Recognition Programs: Employee recognition programs to celebrate achievements and milestones
Show more ","<div class=""description__text description__text--rich"">
        
    
    
    

    <section data-max-lines=""5"" class=""show-more-less-html"">
        <div class=""show-more-less-html__markup show-more-less-html__markup--clamp-after-5
            relative overflow-hidden"">
          Are you passionate about identifying fraudulent activity and protecting businesses from financial losses? Do you excel at analyzing patterns, developing insights, and creating proactive solutions to prevent fraud? If you're ready to leverage your analytical skills to safeguard our systems, <strong>our client</strong> has the ideal role for you. We're looking for a <strong>Fraud Data Analyst</strong> (aka The Fraud Detector) to analyze transaction data, detect potential fraud, and enhance risk mitigation strategies across the organization.<br><br>As a Fraud Data Analyst at <strong>our client</strong>, you'll work with fraud prevention teams, data scientists, and risk management to develop models, identify patterns, and implement fraud detection strategies. Your role will be critical in ensuring that potential fraud is detected early and that our client's financial assets and reputation remain protected.<br><br><strong>Key Responsibilities:<br><br></strong><ul><li>Analyze Transaction Data for Fraud Detection:</li><li>Perform in-depth analyses of transaction data to identify patterns indicative of fraud. You'll use statistical methods to spot anomalies and flag suspicious activities for further investigation</li><li>Develop and Maintain Fraud Detection Models:</li><li>Build predictive models to detect fraudulent behavior in real-time using machine learning and data analytics tools. You'll implement algorithms that help automate fraud detection</li><li>Collaborate on Risk Assessment and Prevention Strategies:</li><li>Work closely with risk management teams to design fraud prevention strategies. You'll provide insights on vulnerabilities and recommend solutions to strengthen fraud defenses</li><li>Conduct Root Cause Analysis on Fraud Incidents:</li><li>Investigate fraudulent activities to understand their origins and impacts. You'll perform root cause analysis to identify gaps in current controls and suggest improvements</li><li>Create and Maintain Fraud Detection Dashboards:</li><li>Design and maintain dashboards using tools like Tableau or Power BI to provide real-time monitoring of fraud metrics. You'll ensure that stakeholders have access to actionable insights</li><li>Implement Data-Driven Rules and Alerts:</li><li>Establish data-driven rules and thresholds for flagging suspicious activities. You'll create automated alerts that enable faster responses to potential fraud cases</li><li>Stay Updated on Fraud Trends and Techniques:</li><li>Keep abreast of the latest trends in fraud schemes, methodologies, and detection technologies. You'll bring innovative strategies to improve fraud prevention and detection<br><br><br></li></ul><strong>Requirements<br><br></strong><strong>Required Skills:<br><br></strong><ul><li> Fraud Analysis and Pattern Recognition: Strong ability to detect patterns, anomalies, and indicators of fraud in data. Familiarity with transaction data analysis and fraud detection techniques</li><li> Predictive Modeling and Machine Learning: Experience building models for fraud detection using supervised and unsupervised learning techniques. Familiarity with tools like Python, R, or SQL for model development</li><li> Risk Assessment and Prevention: Understanding of risk management principles and strategies for fraud prevention. Ability to recommend preventive actions based on data insights</li><li> Data Visualization and Reporting: Proficiency in data visualization tools like Tableau, Power BI, or Looker for creating dashboards and presenting fraud data to stakeholders</li><li> Collaboration and Communication: Excellent communication skills for working with cross-functional teams and explaining complex fraud patterns to non-technical audiences<br><br><br></li></ul><strong>Educational Requirements:<br><br></strong><ul><li> Bachelor's or Master's degree in Data Science, Statistics, Business Analytics, Finance, or a related field. Equivalent experience in fraud analytics or risk management may be considered</li><li>Certifications in fraud examination or analytics (e.g., Certified Fraud Examiner (CFE), Certified Analytics Professional) are advantageous<br><br><br></li></ul><strong>Experience Requirements:<br><br></strong><ul><li> 3+ years of experience in fraud analysis, risk management, or data analytics, with a proven track record of detecting and preventing fraudulent activities</li><li>Familiarity with financial services, e-commerce, or insurance fraud detection is highly beneficial</li><li>Experience with real-time data processing and anomaly detection is a plus<br><br><br></li></ul><strong>Benefits<br><br></strong><ul><li>Health and Wellness: Comprehensive medical, dental, and vision insurance plans with low co-pays and premiums</li><li>Paid Time Off: Competitive vacation, sick leave, and 20 paid holidays per year</li><li>Work-Life Balance: Flexible work schedules and telecommuting options</li><li>Professional Development: Opportunities for training, certification reimbursement, and career advancement programs</li><li>Wellness Programs: Access to wellness programs, including gym memberships, health screenings, and mental health resources</li><li>Life and Disability Insurance: Life insurance and short-term/long-term disability coverage</li><li>Employee Assistance Program (EAP): Confidential counseling and support services for personal and professional challenges</li><li>Tuition Reimbursement: Financial assistance for continuing education and professional development</li><li>Community Engagement: Opportunities to participate in community service and volunteer activities</li><li>Recognition Programs: Employee recognition programs to celebrate achievements and milestones</li></ul>
        </div>

        

    
    
    

    <button aria-expanded=""false"" aria-label=""i18n_show_more"" data-tracking-control-name=""public_jobs_show-more-html-btn"" class=""show-more-less-html__button show-more-less-button
        show-more-less-html__button--more
        ml-0.5"">
<!---->
        
            Show more
          

          <icon class=""show-more-less-html__button-icon show-more-less-button-icon lazy-loaded"" aria-hidden=""true"" aria-busy=""false""><svg xmlns=""http://www.w3.org/2000/svg"" width=""16"" height=""16"" preserveAspectRatio=""xMinYMin meet"" focusable=""false"" class=""lazy-loaded"" aria-busy=""false""><path d=""M8 9l5.93-4L15 6.54l-6.15 4.2a1.5 1.5 0 01-1.69 0L1 6.54 2.07 5z"" fill=""currentColor""></path></svg></icon>
    </button>
  

        

    
    
    

    <button aria-expanded=""true"" aria-label=""i18n_show_less"" data-tracking-control-name=""public_jobs_show-less-html-btn"" class=""show-more-less-html__button show-more-less-button
        show-more-less-html__button--less
        ml-0.5"">
<!---->
        
            Show less
          

          <icon class=""show-more-less-html__button-icon show-more-less-button-icon lazy-loaded"" aria-hidden=""true"" aria-busy=""false""><svg xmlns=""http://www.w3.org/2000/svg"" width=""16"" height=""16"" preserveAspectRatio=""xMinYMin meet"" focusable=""false"" class=""lazy-loaded"" aria-busy=""false""><path d=""M8 7l-5.9 4L1 9.5l6.2-4.2c.5-.3 1.2-.3 1.7 0L15 9.5 13.9 11 8 7z"" fill=""currentColor""></path></svg></icon>
    </button>
  
<!---->    </section>
  
      </div>",2024-11-06,[]
